scenario,proverb,wisdom,translation
"Kemi tried pleasing a rude client with extra work, but he complained. She delivered quality and moved on, staying positive. Her focus kept her productive.","Báa gún iyán, táa ro ọkà fún kòfẹ́kògbà, kò ní fẹ́, kò ní gbà, náà ni","Be forward-looking, be positive; do your best and keep moving.","Even if you pound yam and prepare yam flour meal for a contentious person, he or she will yet remain contentious"
"Jide cooked for a picky neighbor, who criticized it. He stayed kind but sought better clients, ignoring negativity.","Báa gún iyán, táa ro ọkà fún kòfẹ́kògbà, kò ní fẹ́, kò ní gbà, náà ni","Be forward-looking, be positive; do your best and keep moving.","Even if you pound yam and prepare yam flour meal for a contentious person, he or she will yet remain contentious"
"Sade met a demanding boss’s requests, yet faced complaints. She did her best, then aimed for new opportunities.","Báa gún iyán, táa ro ọkà fún kòfẹ́kògbà, kò ní fẹ́, kò ní gbà, náà ni","Be forward-looking, be positive; do your best and keep moving.","Even if you pound yam and prepare yam flour meal for a contentious person, he or she will yet remain contentious"
"Funmi gave food to a struggling friend endlessly, draining herself. She taught him to cook, empowering him to thrive. Enabling self-help felt better.",Àjọjẹ ò dùn bí ẹnìkan ò bá ní; ọjọ́ a ní la ńṣe àjọjẹ,"It's good to give to others, but better to empower them to help themselves.","Sharing a meal isn't pleasant when one party persistently lacks; we are usually happy to share, when we all can give"
"Tolu lent money to his cousin repeatedly, creating dependency. He funded a small business for her, fostering independence.",Àjọjẹ ò dùn bí ẹnìkan ò bá ní; ọjọ́ a ní la ńṣe àjọjẹ,"It's good to give to others, but better to empower them to help themselves.","Sharing a meal isn't pleasant when one party persistently lacks; we are usually happy to share, when we all can give"
"Aisha shared resources with her team, but taught skills too. Their growth made sharing joyful.",Àjọjẹ ò dùn bí ẹnìkan ò bá ní; ọjọ́ a ní la ńṣe àjọjẹ,"It's good to give to others, but better to empower them to help themselves.","Sharing a meal isn't pleasant when one party persistently lacks; we are usually happy to share, when we all can give"
"Chidi left his tools out, and they were stolen. He locked them up after, valuing care. Neglect cost him dearly.",Ohun tí a bá fi sílẹ̀ lẹnu ewúrẹ́ ńtó,"Ultimately, we lose whatever we neglect: care for what you value.","What is left unattended, is what the goat's mouth can get to"
"Kemi ignored her garden, and weeds overtook it. She tended it daily, saving crops, learning to nurture what matters.",Ohun tí a bá fi sílẹ̀ lẹnu ewúrẹ́ ńtó,"Ultimately, we lose whatever we neglect: care for what you value.","What is left unattended, is what the goat's mouth can get to"
"Tolu skipped car maintenance, facing breakdowns. Regular checks saved it, showing care prevents loss.",Ohun tí a bá fi sílẹ̀ lẹnu ewúrẹ́ ńtó,"Ultimately, we lose whatever we neglect: care for what you value.","What is left unattended, is what the goat's mouth can get to"
"Emeka’s startup struggled early with funding issues. He persisted, and it grew profitable, proving tough starts can win. Hope kept him going.","Ọ̀rọ̀ tó máa di akàn, bí ẹja ni í kọ́kọ́ máa ńrí","Don't quit; keep hope alive; if you won't give up, you will win, eventually.","What will turn out favourable eventually, often starts out with much challenges"
"Aisha’s shop faced slow sales at first, discouraging her. Steady effort brought loyal customers, showing persistence pays.","Ọ̀rọ̀ tó máa di akàn, bí ẹja ni í kọ́kọ́ máa ńrí","Don't quit; keep hope alive; if you won't give up, you will win, eventually.","What will turn out favourable eventually, often starts out with much challenges"
"Jide’s novel was rejected initially, but he revised it. A publisher accepted it, rewarding his endurance.","Ọ̀rọ̀ tó máa di akàn, bí ẹja ni í kọ́kọ́ máa ńrí","Don't quit; keep hope alive; if you won't give up, you will win, eventually.","What will turn out favourable eventually, often starts out with much challenges"
"Tunde envied farmers’ profits, ignoring their toil. He tried farming, facing harsh labor, and respected their grind. Critical thinking humbled him.",Oko dùn ún ro l'àgbẹ̀dẹ ṣe ńrọ ọkọ́,Look beyond the surface: think critically; don't be naive or simplistic; things are often not quite as they appear.,"If farming were that fantastic, would blacksmiths opt to make hoes (for others)?"
"Kemi saw influencers’ fame, missing their hustle. She tried content creation, learning its challenges, and valued depth.",Oko dùn ún ro l'àgbẹ̀dẹ ṣe ńrọ ọkọ́,Look beyond the surface: think critically; don't be naive or simplistic; things are often not quite as they appear.,"If farming were that fantastic, would blacksmiths opt to make hoes (for others)?"
"Sade thought teaching was easy, seeing high pay. She taught, facing stress, and saw beyond appearances.",Oko dùn ún ro l'àgbẹ̀dẹ ṣe ńrọ ọkọ́,Look beyond the surface: think critically; don't be naive or simplistic; things are often not quite as they appear.,"If farming were that fantastic, would blacksmiths opt to make hoes (for others)?"
"Chidi feared pitching his idea, stalling his startup. He risked it, landing investors, proving boldness wins. Calculated risks paid off.","Ẹni tó ńbẹ̀rù àti ṣubú, àti dìde á nira fún un","Nothing ventured, nothing gained; be bullish; be open to taking calculated risks.",Whoever is scared of falling will find rising pretty tough
"Aisha avoided stocks, scared of loss. She invested small, earning profits, seeing risk’s value.","Ẹni tó ńbẹ̀rù àti ṣubú, àti dìde á nira fún un","Nothing ventured, nothing gained; be bullish; be open to taking calculated risks.",Whoever is scared of falling will find rising pretty tough
"Tolu shunned public speaking, fearing failure. He spoke, gaining clients, embracing bold moves.","Ẹni tó ńbẹ̀rù àti ṣubú, àti dìde á nira fún un","Nothing ventured, nothing gained; be bullish; be open to taking calculated risks.",Whoever is scared of falling will find rising pretty tough
"Kemi compared her sales to a rival’s, feeling slow. She focused on her unique brand, doubling revenue. Staying in her lane worked.",A kì í wo ago aláago ṣiṣẹ́,Compare yourself with no one: you don't know anyone's story; stay in your lane; be focused.,Don't carry out your duties using someone else's time piece
"Jide timed his workouts to match his friend’s, burning out. He set his own pace, improving fitness, valuing his path.",A kì í wo ago aláago ṣiṣẹ́,Compare yourself with no one: you don't know anyone's story; stay in your lane; be focused.,Don't carry out your duties using someone else's time piece
"Sade copied her colleague’s style, losing authenticity. She embraced her own, earning respect.",A kì í wo ago aláago ṣiṣẹ́,Compare yourself with no one: you don't know anyone's story; stay in your lane; be focused.,Don't carry out your duties using someone else's time piece
"Tolu panicked during a project crisis, worsening it. He calmed down, solving it step-by-step, proving patience wins. Cooler heads prevailed.","Òkun kì í hó ruru, kí á wà á ruru",Be patient; complex issues must be calmly handled: cooler heads must always prevail.,Never paddle wildly in a stormy sea
"Amaka rushed a repair, breaking her phone. Slow care fixed it later, teaching calm precision.","Òkun kì í hó ruru, kí á wà á ruru",Be patient; complex issues must be calmly handled: cooler heads must always prevail.,Never paddle wildly in a stormy sea
"Chidi argued in a dispute, escalating it. He listened calmly, resolving it peacefully.","Òkun kì í hó ruru, kí á wà á ruru",Be patient; complex issues must be calmly handled: cooler heads must always prevail.,Never paddle wildly in a stormy sea
"Funmi envied her friend’s fast career, feeling inferior. She focused on her unique skills, thriving in her role. Staying in her lane brought peace.","Kò sí bí imú ṣe lè tóbi tó, kó lè gba ọ̀rọ̀ ẹnu sọ",We all are unique with our different strengths; envy no one: stay in your lane.,"No matter how big the nose is, it can't take over the speaking role of the mouth"
"Jide chased his rival’s wealth, losing focus. He built his own brand, succeeding by being himself.","Kò sí bí imú ṣe lè tóbi tó, kó lè gba ọ̀rọ̀ ẹnu sọ",We all are unique with our different strengths; envy no one: stay in your lane.,"No matter how big the nose is, it can't take over the speaking role of the mouth"
"Sade copied others’ styles, diluting her art. Her original work sold better, valuing uniqueness.","Kò sí bí imú ṣe lè tóbi tó, kó lè gba ọ̀rọ̀ ẹnu sọ",We all are unique with our different strengths; envy no one: stay in your lane.,"No matter how big the nose is, it can't take over the speaking role of the mouth"
"Tolu threw a tool at a noisy bird in anger, breaking it. His rage cost him, teaching him to calm down. Fury was self-defeating.","Òkò tí a bá bínú jù, kì í pa ẹyẹ",Actions taken in anger seldom achieve desired results; tone down the fury: it can be self-defeating.,A bird is seldom killed by a stone thrown in anger
"Kemi snapped at a slow cashier, delaying her order. She spoke calmly next time, speeding it up, avoiding anger’s trap.","Òkò tí a bá bínú jù, kì í pa ẹyẹ",Actions taken in anger seldom achieve desired results; tone down the fury: it can be self-defeating.,A bird is seldom killed by a stone thrown in anger
"Chidi yelled at a driver, sparking a fight. He stayed cool later, preventing trouble.","Òkò tí a bá bínú jù, kì í pa ẹyẹ",Actions taken in anger seldom achieve desired results; tone down the fury: it can be self-defeating.,A bird is seldom killed by a stone thrown in anger
"Emeka pushed a failing deal, losing funds. He pulled back, saving his firm, proving timing matters. Knowing when to quit saved him.",Mọ̀jà mọ̀sá ni ti akínkanjú; akínkanjú tó bá mọ̀ọ́ jà tí kò mọ̀ọ́ sá á bá ogun lọ,"Know when to pursue, defer or quit.","Warriors must know when to fight and when to retreat; a warrior who knows when to fight, but not when to retreat will perish in battle"
"Aisha fought a bad project, failing. She paused, succeeding later with better timing.",Mọ̀jà mọ̀sá ni ti akínkanjú; akínkanjú tó bá mọ̀ọ́ jà tí kò mọ̀ọ́ sá á bá ogun lọ,"Know when to pursue, defer or quit.","Warriors must know when to fight and when to retreat; a warrior who knows when to fight, but not when to retreat will perish in battle"
"Tolu argued a lost cause, wasting time. He retreated, resolving it wisely.",Mọ̀jà mọ̀sá ni ti akínkanjú; akínkanjú tó bá mọ̀ọ́ jà tí kò mọ̀ọ́ sá á bá ogun lọ,"Know when to pursue, defer or quit.","Warriors must know when to fight and when to retreat; a warrior who knows when to fight, but not when to retreat will perish in battle"
"Sade prayed during a jobless phase, landing a role. Her faith in God eased her struggle, proving divine help. Trust sustained her.","A kì í mọ orúkọ Ọlọ́run, kí ìyà ó jẹ'ni","God is dependable; He is a present help, for those who trust in Him.",One cannot really know God's name (or know God for sure) and suffer
"Jide trusted God through illness, recovering fast. His belief brought relief, showing God’s dependability.","A kì í mọ orúkọ Ọlọ́run, kí ìyà ó jẹ'ni","God is dependable; He is a present help, for those who trust in Him.",One cannot really know God's name (or know God for sure) and suffer
"Kemi sought divine help in debt, finding aid. Her faith proved God’s presence.","A kì í mọ orúkọ Ọlọ́run, kí ìyà ó jẹ'ni","God is dependable; He is a present help, for those who trust in Him.",One cannot really know God's name (or know God for sure) and suffer
"Tunde slacked on his studies, expecting success. Peers passed him, and he regretted complacency. Seizing time boosted his grades.","Ẹni tó gbé ìlù rẹ̀ kọ́ apá, ayé ńbáa lùú, áḿbọ̀tórí ẹni tó gbé tirẹ̀ kọ́ igi tó ṣeré lọ",No complacency; make hay while the sun shines.#owe#oweyoruba#yorubaproverb#yoruba#proverb#wisdom,"The person who hung his drum on his elbow still had the drum beaten by others, not to mention someone who hung his on a tree (branch) and walked away"
"Amaka delayed her business launch, missing trends. She acted fast later, catching sales, valuing urgency.","Ẹni tó gbé ìlù rẹ̀ kọ́ apá, ayé ńbáa lùú, áḿbọ̀tórí ẹni tó gbé tirẹ̀ kọ́ igi tó ṣeré lọ",No complacency; make hay while the sun shines.#owe#oweyoruba#yorubaproverb#yoruba#proverb#wisdom,"The person who hung his drum on his elbow still had the drum beaten by others, not to mention someone who hung his on a tree (branch) and walked away"
"Chidi ignored a job offer, losing it. He applied quickly next time, securing work.","Ẹni tó gbé ìlù rẹ̀ kọ́ apá, ayé ńbáa lùú, áḿbọ̀tórí ẹni tó gbé tirẹ̀ kọ́ igi tó ṣeré lọ",No complacency; make hay while the sun shines.#owe#oweyoruba#yorubaproverb#yoruba#proverb#wisdom,"The person who hung his drum on his elbow still had the drum beaten by others, not to mention someone who hung his on a tree (branch) and walked away"
"Kemi fired a worker harshly for a small error. The loss hurt her team, teaching moderation. She coached gently after.",Orí bíbẹ́ kọ́ ni oògùn orí fífọ́,Moderation is it; adopt radical measures with caution.#owe#oweyoruba#yorubaproverb#yoruba#proverb#wisdom,Decapitation is not the antidote for headache
"Tolu banned a friend over a minor feud, regretting it. He reconciled calmly, avoiding drastic steps.",Orí bíbẹ́ kọ́ ni oògùn orí fífọ́,Moderation is it; adopt radical measures with caution.#owe#oweyoruba#yorubaproverb#yoruba#proverb#wisdom,Decapitation is not the antidote for headache
"Sade deleted a project in frustration, losing progress. She tweaked it later, learning restraint.",Orí bíbẹ́ kọ́ ni oògùn orí fífọ́,Moderation is it; adopt radical measures with caution.#owe#oweyoruba#yorubaproverb#yoruba#proverb#wisdom,Decapitation is not the antidote for headache
"Funmi mocked a slow colleague, ignoring their stress. Her intolerance strained ties, but empathy rebuilt them. Tolerance bridged gaps.","Ohun tó ṣe igúnnugún tó fi pá lórí, tó ṣe àkàlàmàgbò tó fi yọ gẹ̀gẹ̀ lọ́rùn, tó bá ṣe àgbò bọ̀lọ̀jọ̀, á ti fa ìwo rẹ̀ tu",Be tolerant; people are different.,"If what balded the vulture and gave the crow goiter had befallen the full-grown ram, it would have lost its horns"
"Jide snapped at his quiet sibling, missing their struggles. He listened, learning people differ.","Ohun tó ṣe igúnnugún tó fi pá lórí, tó ṣe àkàlàmàgbò tó fi yọ gẹ̀gẹ̀ lọ́rùn, tó bá ṣe àgbò bọ̀lọ̀jọ̀, á ti fa ìwo rẹ̀ tu",Be tolerant; people are different.,"If what balded the vulture and gave the crow goiter had befallen the full-grown ram, it would have lost its horns"
"Aisha judged a shy client, losing their trust. She adapted, valuing diverse needs.","Ohun tó ṣe igúnnugún tó fi pá lórí, tó ṣe àkàlàmàgbò tó fi yọ gẹ̀gẹ̀ lọ́rùn, tó bá ṣe àgbò bọ̀lọ̀jọ̀, á ti fa ìwo rẹ̀ tu",Be tolerant; people are different.,"If what balded the vulture and gave the crow goiter had befallen the full-grown ram, it would have lost its horns"
"Tolu trusted a shady investor naively, losing funds. He researched deals after, avoiding scams. Knowledge saved him.","Òròmọadìyẹ ńbá àṣá ṣeré, ó rò pé ẹyẹ oko lásán ni","Naivety can be risky, if not fatally costly; invest in knowledge.",The chick gullibly plays with the hawk believing it to be an ordinary bird
"Kemi shared secrets with a new friend, who gossiped. She vetted allies, learning perception’s value.","Òròmọadìyẹ ńbá àṣá ṣeré, ó rò pé ẹyẹ oko lásán ni","Naivety can be risky, if not fatally costly; invest in knowledge.",The chick gullibly plays with the hawk believing it to be an ordinary bird
"Chidi joined a risky group, facing trouble. He grew cautious, proving naivety’s cost.","Òròmọadìyẹ ńbá àṣá ṣeré, ó rò pé ẹyẹ oko lásán ni","Naivety can be risky, if not fatally costly; invest in knowledge.",The chick gullibly plays with the hawk believing it to be an ordinary bird
"Sade trusted her charming boss, who ignored her work. His actions showed disinterest, teaching her to watch closely. Perception clarified truth.","Ẹni a fẹ́ la mọ̀, a ò mọ ẹni tó fẹ́'ni",Be perceptive; things are often not as they appear.,"You do know who you love for sure, but you cannot be certain of who really loves you"
"Jide lent money to a friend’s sweet talk, unreturned. He checked actions, seeing true intent.","Ẹni a fẹ́ la mọ̀, a ò mọ ẹni tó fẹ́'ni",Be perceptive; things are often not as they appear.,"You do know who you love for sure, but you cannot be certain of who really loves you"
"Tolu admired a mentor’s gifts, missing their neglect. He valued deeds, learning appearances deceive.","Ẹni a fẹ́ la mọ̀, a ò mọ ẹni tó fẹ́'ni",Be perceptive; things are often not as they appear.,"You do know who you love for sure, but you cannot be certain of who really loves you"
"Kemi bragged about her sales, annoying clients. Her boasts cost deals, teaching modesty. Quiet work won trust.","Ẹnu ẹyẹ ni í pẹyẹ; ẹnu òrofó ni í pa òrofó; òrofó bímọ mẹ́fà, ó ní ilé òun kún ṣọ́ṣọ́",Modesty is it; brag less.,The mouth of a bird is its undoing; the wild pidgeon hatches just six chicks and brags that its nest is completely filled up
"Aisha exaggerated her skills, failing tasks. She stayed humble, earning respect with results.","Ẹnu ẹyẹ ni í pẹyẹ; ẹnu òrofó ni í pa òrofó; òrofó bímọ mẹ́fà, ó ní ilé òun kún ṣọ́ṣọ́",Modesty is it; brag less.,The mouth of a bird is its undoing; the wild pidgeon hatches just six chicks and brags that its nest is completely filled up
"Chidi boasted about his car, alienating friends. He spoke less, valuing restraint.","Ẹnu ẹyẹ ni í pẹyẹ; ẹnu òrofó ni í pa òrofó; òrofó bímọ mẹ́fà, ó ní ilé òun kún ṣọ́ṣọ́",Modesty is it; brag less.,The mouth of a bird is its undoing; the wild pidgeon hatches just six chicks and brags that its nest is completely filled up
"Tolu worked tirelessly, opening a shop anywhere. His diligence thrived in tough markets, proving effort pays. Hard work brought success.",Ìrèké ò ní ibùdó; ibi gbogbo ló gba alágbára,Diligence pays.#owe#oweyoruba#yorubaproverb#yoruba#proverb,Sugarcane has no specific place of refuge; every situation suits a diligent fellow just fine
"Kemi sold crafts in any season, outpacing rivals. Her persistence won clients, showing diligence’s reward.",Ìrèké ò ní ibùdó; ibi gbogbo ló gba alágbára,Diligence pays.#owe#oweyoruba#yorubaproverb#yoruba#proverb,Sugarcane has no specific place of refuge; every situation suits a diligent fellow just fine
"Jide taught extra classes, earning more. His grit succeeded, valuing steady effort.",Ìrèké ò ní ibùdó; ibi gbogbo ló gba alágbára,Diligence pays.#owe#oweyoruba#yorubaproverb#yoruba#proverb,Sugarcane has no specific place of refuge; every situation suits a diligent fellow just fine
"Sade ignored her mentor’s advice, failing a test. She studied it later, passing, proving openness matters. Wise counsel worked.",Ajá tó máa sọnù kì í gbọ́ fèrè ọlọ́dẹ,Those bent on a course of action won't heed wiser counsels; keep an open mind: there is some sense in nonsense.,A dog destined to get lost won't hear the hunter's (redeeming) whistling
"Chidi dismissed a warning, losing funds. He listened after, saving deals, learning from others.",Ajá tó máa sọnù kì í gbọ́ fèrè ọlọ́dẹ,Those bent on a course of action won't heed wiser counsels; keep an open mind: there is some sense in nonsense.,A dog destined to get lost won't hear the hunter's (redeeming) whistling
"Aisha rejected feedback, stalling her art. She embraced it, improving, valuing advice.",Ajá tó máa sọnù kì í gbọ́ fèrè ọlọ́dẹ,Those bent on a course of action won't heed wiser counsels; keep an open mind: there is some sense in nonsense.,A dog destined to get lost won't hear the hunter's (redeeming) whistling
"Funmi tried one job path, failing repeatedly. She took a coding course, succeeding, proving alternatives exist. Flexibility opened doors.",Ibi kan ṣoṣo kọ́ la ti ńrí ọ̀run,Alternative approaches exist; there are many ways to achieve a goal: don't be fixated on one.,The sky is not seen from only one single spot
"Tolu stuck to one supplier, facing shortages. He found others, stabilizing stock, showing multiple routes.",Ibi kan ṣoṣo kọ́ la ti ńrí ọ̀run,Alternative approaches exist; there are many ways to achieve a goal: don't be fixated on one.,The sky is not seen from only one single spot
"Jide used one marketing tactic, losing sales. He tried ads, boosting revenue, valuing options.",Ibi kan ṣoṣo kọ́ la ti ńrí ọ̀run,Alternative approaches exist; there are many ways to achieve a goal: don't be fixated on one.,The sky is not seen from only one single spot
"Kemi survived a layoff, starting a blog. Her resilience built a career, proving life offers chances. Hope fueled her rise.","Ẹni tí kò tíì kúrò láyé, kò lè mọ irú ẹni tí òun yó dà","With life, there's no impossibility; it's not over yet: keep hope alive.","Whoever still has life, cannot be limited in what he or she can become"
"Aisha rebuilt after a fire, opening a new stall. Her persistence thrived, showing no limits with life.","Ẹni tí kò tíì kúrò láyé, kò lè mọ irú ẹni tí òun yó dà","With life, there's no impossibility; it's not over yet: keep hope alive.","Whoever still has life, cannot be limited in what he or she can become"
"Tolu overcame debt, launching a firm. His grit succeeded, proving possibilities endure.","Ẹni tí kò tíì kúrò láyé, kò lè mọ irú ẹni tí òun yó dà","With life, there's no impossibility; it's not over yet: keep hope alive.","Whoever still has life, cannot be limited in what he or she can become"
"Sade chose a risky job, facing stress alone. Her choice’s toll taught her accountability. She coped, owning her path.","A kì í ní k'ọ́mọ ẹni má d'ẹ́tẹ̀, tó bá ti lè dá'gbó gbé",Everyone bears the consequences of his or her choices.,"You never restrain your child from becoming leprous, as long as he can live in the forest alone"
"Chidi ignored health warnings, falling ill. He recovered, learning choices have consequences.","A kì í ní k'ọ́mọ ẹni má d'ẹ́tẹ̀, tó bá ti lè dá'gbó gbé",Everyone bears the consequences of his or her choices.,"You never restrain your child from becoming leprous, as long as he can live in the forest alone"
"Kemi moved far for work, missing family. She adjusted, accepting her decision’s cost.","A kì í ní k'ọ́mọ ẹni má d'ẹ́tẹ̀, tó bá ti lè dá'gbó gbé",Everyone bears the consequences of his or her choices.,"You never restrain your child from becoming leprous, as long as he can live in the forest alone"
"Tolu’s laziness lost him clients, who shunned him. His character caused rejection, teaching him to change. Effort rebuilt his name.","Ìwà ọ̀lẹ ló ńba ọ̀lẹ lẹ́rù; ọ̀lẹ ṣe tán, ó ní wọn ò fẹ́ràn òun",Our character often confronts us with unpleasant consequences; change your character to change any unwanted outcome.,An indolent is preceded by his character but at the end complains that he or she is not accepted
"Aisha’s gossip habit cost friends, isolating her. She became kind, regaining trust, proving character shapes outcomes.","Ìwà ọ̀lẹ ló ńba ọ̀lẹ lẹ́rù; ọ̀lẹ ṣe tán, ó ní wọn ò fẹ́ràn òun",Our character often confronts us with unpleasant consequences; change your character to change any unwanted outcome.,An indolent is preceded by his character but at the end complains that he or she is not accepted
"Jide’s rudeness turned off partners, hurting deals. He softened, succeeding, valuing character’s impact.","Ìwà ọ̀lẹ ló ńba ọ̀lẹ lẹ́rù; ọ̀lẹ ṣe tán, ó ní wọn ò fẹ́ràn òun",Our character often confronts us with unpleasant consequences; change your character to change any unwanted outcome.,An indolent is preceded by his character but at the end complains that he or she is not accepted
"Kemi judged a colleague unheard, sparking conflict. She listened later, resolving it, giving doubt’s benefit. Fairness restored peace.",A kì í bínú sí ẹni tí a kò rí,Never rush to judgment; there is always a chance you could be wrong; always give people the benefit of the doubt.,Do not be angry with someone you have not heard out
