scenario,proverb,wisdom,translation
"Chidi coded a game at 20, outpacing older rivals. His hit proved age is no barrier.","Iṣu ẹni kì í fi'ni pe ọmọdé, kó má ta",Age is no barrier to success; impossibility is a figment.,"A yam plant cannot refuse to grow well, simply because the farmer (planter) is too young"
"Kemi ignored her mentor’s marketing tips, and sales tanked. She sought advice later, boosting revenue. Valuing counsel saved her.","Ọba tí kì í fẹ́ gba ìmọ̀ràn, irú wọn kì í pẹ́ fi ẹsẹ̀ kọ",Be smart: seek and treasure good counsels; to spurn such is to expose oneself to avoidable errors.,"Any king who is reluctant to taking advices, hardly takes long before stumbling"
"Jide spurned his boss’s feedback, missing a promotion. He listened next time, earning it, proving advice prevents errors.","Ọba tí kì í fẹ́ gba ìmọ̀ràn, irú wọn kì í pẹ́ fi ẹsẹ̀ kọ",Be smart: seek and treasure good counsels; to spurn such is to expose oneself to avoidable errors.,"Any king who is reluctant to taking advices, hardly takes long before stumbling"
"Tolu rejected a colleague’s warning, losing a deal. He treasured input after, closing contracts.","Ọba tí kì í fẹ́ gba ìmọ̀ràn, irú wọn kì í pẹ́ fi ẹsẹ̀ kọ",Be smart: seek and treasure good counsels; to spurn such is to expose oneself to avoidable errors.,"Any king who is reluctant to taking advices, hardly takes long before stumbling"
"Chidi sampled a client’s product without buying, wasting their time. His indecision annoyed them, teaching him to commit. He followed through later.","Ẹran tí a kò bá ni í jẹ, a kì í fi eyín dán an wò",Don't start what you won't finish; finish whatever you start.,Stop taking nips at a piece of meat that you have no intention of eating
"Amaka nibbled at a free trial, not subscribing. The provider cut access, showing her to finish what she starts.","Ẹran tí a kò bá ni í jẹ, a kì í fi eyín dán an wò",Don't start what you won't finish; finish whatever you start.,Stop taking nips at a piece of meat that you have no intention of eating
"Sade tested a course but didn’t enroll, frustrating the teacher. She completed one later, valuing follow-through.","Ẹran tí a kò bá ni í jẹ, a kì í fi eyín dán an wò",Don't start what you won't finish; finish whatever you start.,Stop taking nips at a piece of meat that you have no intention of eating
"Kemi shunned messy clients, limiting her shop’s growth. She served them, doubling sales, proving tolerance expands reach.","Ààtàn tí kò bá gba ẹ̀gbin, kò ní kún bọ̀rọ̀",Intolerance imposes limitations,A dunghill that's intolerant of filth won't be filled up easily
"Tolu rejected risky partners, stalling deals. He worked with them, gaining contracts, showing intolerance curbs opportunity.","Ààtàn tí kò bá gba ẹ̀gbin, kò ní kún bọ̀rọ̀",Intolerance imposes limitations,A dunghill that's intolerant of filth won't be filled up easily
"Jide banned untidy vendors, losing supplies. He adapted, securing stock, learning openness pays.","Ààtàn tí kò bá gba ẹ̀gbin, kò ní kún bọ̀rọ̀",Intolerance imposes limitations,A dunghill that's intolerant of filth won't be filled up easily
"Tolu rambled at a pitch, confusing clients. He lost the deal but spoke concisely next time, winning contracts. Moderation sharpened his skill.",Ẹni sọ̀rọ̀ púpọ̀ yó ṣìsọ; àsọjù ló ńmú ìyá ọba pe ara rẹ̀ ní ìyá ọ̀bọ,"Moderation is crucial; exercise self-control, always",Whoever talks inordinately will misspeak; inordinate talk made the king's mother (inadvertently) referred to herself as the mother of monkeys
"Amaka overshared in a meeting, sparking rumors. She spoke less, regaining respect through restraint.",Ẹni sọ̀rọ̀ púpọ̀ yó ṣìsọ; àsọjù ló ńmú ìyá ọba pe ara rẹ̀ ní ìyá ọ̀bọ,"Moderation is crucial; exercise self-control, always",Whoever talks inordinately will misspeak; inordinate talk made the king's mother (inadvertently) referred to herself as the mother of monkeys
"Sade chatted endlessly at work, missing deadlines. She focused, boosting output with control.",Ẹni sọ̀rọ̀ púpọ̀ yó ṣìsọ; àsọjù ló ńmú ìyá ọba pe ara rẹ̀ ní ìyá ọ̀bọ,"Moderation is crucial; exercise self-control, always",Whoever talks inordinately will misspeak; inordinate talk made the king's mother (inadvertently) referred to herself as the mother of monkeys
"Emeka prayed through a jobless phase, finding a role. His faith in God’s presence sustained him, proving hope endures. Divine trust worked.","Ọlọ́run tó ńse ọbẹ̀, kò kúrò ní ìdí ààrò",Never lose hope; nothing is beyond God.,"God who is cooking the soup, has not left the kitchen"
"Aisha trusted God during a flood, finding shelter. Her belief brought aid, showing God never leaves.","Ọlọ́run tó ńse ọbẹ̀, kò kúrò ní ìdí ààrò",Never lose hope; nothing is beyond God.,"God who is cooking the soup, has not left the kitchen"
"Tolu sought God in debt, gaining relief. His prayers proved divine care persists.","Ọlọ́run tó ńse ọbẹ̀, kò kúrò ní ìdí ààrò",Never lose hope; nothing is beyond God.,"God who is cooking the soup, has not left the kitchen"
"Chidi endured a harsh job, hoping for change. A promotion came, proving tough times pass. Hope sustained him.",Ààrò kì í gbóná títí kó má tutù,"Whatever is hot today, will one day become cold; tough times won't last forever; keep hope alive; it's not over yet.","No matter how long the fireplace has been hot, it will become cold eventually"
"Kemi’s shop struggled in a slump, but sales rebounded. She held on, seeing seasons shift.",Ààrò kì í gbóná títí kó má tutù,"Whatever is hot today, will one day become cold; tough times won't last forever; keep hope alive; it's not over yet.","No matter how long the fireplace has been hot, it will become cold eventually"
"Jide faced loan denials, but one passed. Patience showed hard times end.",Ààrò kì í gbóná títí kó má tutù,"Whatever is hot today, will one day become cold; tough times won't last forever; keep hope alive; it's not over yet.","No matter how long the fireplace has been hot, it will become cold eventually"
"Kemi’s quiet client demanded respect, earning it. Their demeanor set boundaries, teaching her to heed cues. She treated them accordingly.",Akèrègbè ni yóò júwe ibi tí wón máa fi okùn sí lára rẹ̀,"People themselves will indicate to you how you should treat them; and when they do, believe them.",It's the gourd itself that will indicate where on its body the rope (to carry it) should be affixed
"Tolu’s stern vendor outlined terms clearly. He followed them, securing supplies, proving people show their needs.",Akèrègbè ni yóò júwe ibi tí wón máa fi okùn sí lára rẹ̀,"People themselves will indicate to you how you should treat them; and when they do, believe them.",It's the gourd itself that will indicate where on its body the rope (to carry it) should be affixed
"Aisha’s shy friend set firm limits. She respected them, strengthening ties, valuing self-indication.",Akèrègbè ni yóò júwe ibi tí wón máa fi okùn sí lára rẹ̀,"People themselves will indicate to you how you should treat them; and when they do, believe them.",It's the gourd itself that will indicate where on its body the rope (to carry it) should be affixed
"Tolu snapped at a slow worker, pressured by deadlines. His anger misfired, but he later coached calmly, improving output. Tolerance eased tension.","Kò sí ẹni tó máa gun ẹṣin, tí kò ní ju ìpàkọ́, tí kò bá fẹ́ẹ́ jùú, ẹṣin tó ńgùn a jẹ́ kó jùú",Be tolerant; our attitudes are quite often compelled by our peculiar circumstances.,"No one will ride a horse and not fling his head backward; even if he/she doesn't want to, the horse will make him/her do it"
"Amaka rushed a delivery, stressed by traffic. Her haste failed, but patience later succeeded, showing circumstances shape actions.","Kò sí ẹni tó máa gun ẹṣin, tí kò ní ju ìpàkọ́, tí kò bá fẹ́ẹ́ jùú, ẹṣin tó ńgùn a jẹ́ kó jùú",Be tolerant; our attitudes are quite often compelled by our peculiar circumstances.,"No one will ride a horse and not fling his head backward; even if he/she doesn't want to, the horse will make him/her do it"
"Chidi yelled at a late supplier, under strain. He negotiated calmly after, learning tolerance for situations.","Kò sí ẹni tó máa gun ẹṣin, tí kò ní ju ìpàkọ́, tí kò bá fẹ́ẹ́ jùú, ẹṣin tó ńgùn a jẹ́ kó jùú",Be tolerant; our attitudes are quite often compelled by our peculiar circumstances.,"No one will ride a horse and not fling his head backward; even if he/she doesn't want to, the horse will make him/her do it"
"Kemi sold stock early on drought rumors, regretting it when rains came. Her haste cost her, teaching caution. She waited for clarity next time.",A kì í gbọ‌ kúkù òjò da omi agbada nù.*,Don't be presumptuous; never count your chickens before they are hatched.,Never pour away the water in your trough on the rumbling of the cloud
"Jide quit a job on layoff fears, missing a raise. He stayed steady later, avoiding presumption.",A kì í gbọ‌ kúkù òjò da omi agbada nù.*,Don't be presumptuous; never count your chickens before they are hatched.,Never pour away the water in your trough on the rumbling of the cloud
"Tolu discarded crops on storm alerts, losing harvest. He checked facts, saving future yields.",A kì í gbọ‌ kúkù òjò da omi agbada nù.*,Don't be presumptuous; never count your chickens before they are hatched.,Never pour away the water in your trough on the rumbling of the cloud
"Chidi held a grudge against a rude client, missing a deal. He forgave, gaining referrals, proving vindictiveness costs. Letting go paid off.","Bí a bá ní ká dijú kí ẹni burúkú kọjá, a kò ní mọ ìgbà tí ẹni rere máa lọ",Be forward-looking; vidictiveness can be costly.,"If we were to close our eyes so we would not see a wicked person pass by, we may miss a good person as well"
"Amaka avoided a rival out of spite, losing a partnership. She collaborated later, thriving, showing positivity wins.","Bí a bá ní ká dijú kí ẹni burúkú kọjá, a kò ní mọ ìgbà tí ẹni rere máa lọ",Be forward-looking; vidictiveness can be costly.,"If we were to close our eyes so we would not see a wicked person pass by, we may miss a good person as well"
"Tolu shunned a dishonest vendor, but missed profits. He moved on, securing better deals.","Bí a bá ní ká dijú kí ẹni burúkú kọjá, a kò ní mọ ìgbà tí ẹni rere máa lọ",Be forward-looking; vidictiveness can be costly.,"If we were to close our eyes so we would not see a wicked person pass by, we may miss a good person as well"
"Kemi’s kindness drew loyal clients to her shop. Her good character boosted sales, proving it adorns. Integrity shone brightly.",Ìwà rere lẹ̀ṣọ́ ènìyàn,Good character beautifies; it is attractive and adorable.,Good character is what adorns a man
"Jide’s honesty won trust in deals, growing his firm. His character attracted partners, showing its beauty.",Ìwà rere lẹ̀ṣọ́ ènìyàn,Good character beautifies; it is attractive and adorable.,Good character is what adorns a man
"Tolu’s fairness kept his team loyal, enhancing work. His good name lifted his business.",Ìwà rere lẹ̀ṣọ́ ènìyàn,Good character beautifies; it is attractive and adorable.,Good character is what adorns a man
"Chidi ignored his friend’s flaws, preserving their bond. His tolerance deepened ties, proving love needs patience. Overlooking faults endured.",Àmójúkúrò ni í mú ẹ̀mí ìfẹ́ gùn,No one is perfect; tolerance is crucial. Happy Valentine Day to everyone.,Willingness to overlook is what makes loving relationships endure
"Amaka forgave her colleague’s errors, keeping peace. Her willingness to overlook strengthened teamwork, valuing tolerance.",Àmójúkúrò ni í mú ẹ̀mí ìfẹ́ gùn,No one is perfect; tolerance is crucial. Happy Valentine Day to everyone.,Willingness to overlook is what makes loving relationships endure
"Tolu accepted his sibling’s quirks, sustaining family. His patience made love last, showing forgiveness works.",Àmójúkúrò ni í mú ẹ̀mí ìfẹ́ gùn,No one is perfect; tolerance is crucial. Happy Valentine Day to everyone.,Willingness to overlook is what makes loving relationships endure
"Tolu lied about his skills, but failures exposed him. His true self surfaced, teaching authenticity. Honesty rebuilt trust.","Báa gún ata ńnú odó, báa lọ̀ ọ́ lórí ọlọ, iwa ata ò ní fi ata sílẹ̀","We can hardly pretend to be who we are not for long: with time, who we really are will show through.","Whether pounded in a mortar or ground on a grinding stone, pepper would remain inseparable from its character"
"Kemi faked kindness at work, but rudeness leaked. Her real nature showed, proving pretense fails.","Báa gún ata ńnú odó, báa lọ̀ ọ́ lórí ọlọ, iwa ata ò ní fi ata sílẹ̀","We can hardly pretend to be who we are not for long: with time, who we really are will show through.","Whether pounded in a mortar or ground on a grinding stone, pepper would remain inseparable from its character"
"Aisha hid her temper, but it flared, costing friends. Her true character emerged, valuing sincerity.","Báa gún ata ńnú odó, báa lọ̀ ọ́ lórí ọlọ, iwa ata ò ní fi ata sílẹ̀","We can hardly pretend to be who we are not for long: with time, who we really are will show through.","Whether pounded in a mortar or ground on a grinding stone, pepper would remain inseparable from its character"
"Kemi overused her team’s budget, facing cuts. She budgeted wisely later, saving projects, proving restraint matters. Control prevented abuse.","Ẹni tó ńgun ẹṣin, kó sọ ìpàkọ‌ mọ ní'wọ‌n; ìbẹ‌kẹ‌ṣẹ‌ ẹṣin á máa la’ni mọ‌’lẹ‌",Never abuse privileges: exercise self-control; safeguards against abuse do exist.,"When on a horse, fling your head backward with restraint; horses with sudden jump often throw riders"
"Tolu borrowed tools freely, breaking them. He used his own after, learning privilege has limits.","Ẹni tó ńgun ẹṣin, kó sọ ìpàkọ‌ mọ ní'wọ‌n; ìbẹ‌kẹ‌ṣẹ‌ ẹṣin á máa la’ni mọ‌’lẹ‌",Never abuse privileges: exercise self-control; safeguards against abuse do exist.,"When on a horse, fling your head backward with restraint; horses with sudden jump often throw riders"
"Jide partied with company funds, facing audits. He spent modestly, showing safeguards curb excess.","Ẹni tó ńgun ẹṣin, kó sọ ìpàkọ‌ mọ ní'wọ‌n; ìbẹ‌kẹ‌ṣẹ‌ ẹṣin á máa la’ni mọ‌’lẹ‌",Never abuse privileges: exercise self-control; safeguards against abuse do exist.,"When on a horse, fling your head backward with restraint; horses with sudden jump often throw riders"
"Chidi refused to serve a rude client, missing sales. He served all later, boosting revenue, proving fairness matters. Equality drove growth.",Òjò ò bá ẹnìkan ṣọ̀tá; ẹni ejí rí leji ńpa,Discriminate against no one.,The rain holds enmity with no one; it beats anyone within it's area of coverage
"Amaka ignored a poor customer, losing loyalty. She treated all equally, gaining fans, showing no discrimination.",Òjò ò bá ẹnìkan ṣọ̀tá; ẹni ejí rí leji ńpa,Discriminate against no one.,The rain holds enmity with no one; it beats anyone within it's area of coverage
"Tolu skipped a small order, regretting it. He filled all, growing his shop, valuing inclusivity.",Òjò ò bá ẹnìkan ṣọ̀tá; ẹni ejí rí leji ńpa,Discriminate against no one.,The rain holds enmity with no one; it beats anyone within it's area of coverage
"Kemi trusted a charming investor who vanished with funds. His fake humility fooled her, teaching her to probe deeper. She vetted allies after.","Bí ẹ̀dá bá fẹ́ gba àwìn ẹ̀bà, ni wọ́n máa ńṣe ojú àánú; tí wọ́n bá yó tán, wọ́n á di ọkọ olúwa wọn","We cannot claim to truly know anyone, deep down.","People present a facade of humility when seeking favour, but easily lord it over their benefactors, once satisfied"
"Tolu hired a flattering intern who stole credit. Their facade hid motives, showing people reveal true selves.","Bí ẹ̀dá bá fẹ́ gba àwìn ẹ̀bà, ni wọ́n máa ńṣe ojú àánú; tí wọ́n bá yó tán, wọ́n á di ọkọ olúwa wọn","We cannot claim to truly know anyone, deep down.","People present a facade of humility when seeking favour, but easily lord it over their benefactors, once satisfied"
"Jide lent to a humble friend who ghosted him. He learned facades mask intent, checking actions.","Bí ẹ̀dá bá fẹ́ gba àwìn ẹ̀bà, ni wọ́n máa ńṣe ojú àánú; tí wọ́n bá yó tán, wọ́n á di ọkọ olúwa wọn","We cannot claim to truly know anyone, deep down.","People present a facade of humility when seeking favour, but easily lord it over their benefactors, once satisfied"
"Tolu blamed his rival for a loss, but they collaborated later. His naivety missed allies, teaching him to look deeper. Clarity saved deals.","Tí nani-nani bá ńnani, tí gbani-gbani kọ̀ tí kò gbani, á jẹ́ pé gbani-gbani  ló ní kí nani-nani máa nani",Don't be naive; look beyond the obvious.,"If the beater, beats one, but the deliverer refuses to deliver one, the beating must have been endorsed by the deliverer"
"Amaka trusted a loud critic, ignoring their bias. She saw their motive, avoiding traps, proving depth matters.","Tí nani-nani bá ńnani, tí gbani-gbani kọ̀ tí kò gbani, á jẹ́ pé gbani-gbani  ló ní kí nani-nani máa nani",Don't be naive; look beyond the obvious.,"If the beater, beats one, but the deliverer refuses to deliver one, the beating must have been endorsed by the deliverer"
"Jide followed a flashy ad, losing money. He checked facts, learning appearances deceive.","Tí nani-nani bá ńnani, tí gbani-gbani kọ̀ tí kò gbani, á jẹ́ pé gbani-gbani  ló ní kí nani-nani máa nani",Don't be naive; look beyond the obvious.,"If the beater, beats one, but the deliverer refuses to deliver one, the beating must have been endorsed by the deliverer"
"Chidi tried pleasing a rude client with extra work, but they complained. He delivered quality and moved on, staying positive. Focus kept him steady.","Báa gún iyán, táa ro ọkà fún kòfẹ‌kògbà, kò ní fẹ‌, kò ní gbà, náà ni","Be forward-looking, be positive; do your best and keep moving.","Even if you pound yam and prepare yam flour meal for a cantankerous person, he or she will yet remain cantankerous"
"Amaka cooked for a picky neighbor, who griped. She stayed kind but sought better ties, ignoring negativity.","Báa gún iyán, táa ro ọkà fún kòfẹ‌kògbà, kò ní fẹ‌, kò ní gbà, náà ni","Be forward-looking, be positive; do your best and keep moving.","Even if you pound yam and prepare yam flour meal for a cantankerous person, he or she will yet remain cantankerous"
"Tolu met a demanding boss’s requests, facing complaints. He did his best, aiming for new roles.","Báa gún iyán, táa ro ọkà fún kòfẹ‌kògbà, kò ní fẹ‌, kò ní gbà, náà ni","Be forward-looking, be positive; do your best and keep moving.","Even if you pound yam and prepare yam flour meal for a cantankerous person, he or she will yet remain cantankerous"
"Kemi joined a risky venture naively, losing savings. She researched after, avoiding scams, proving knowledge saves. Caution protected her.","Ọmọdé kékeré ò mọ ogun, ó ní k'ógun ó wá, ó ní b'ógún bá dé, òun a kó s'íyàrá ìyá òun",Naivety can be costly.,"A youngster, naive about wars, beckons on it, stating that once war comes, he/she will hide in his/her mother's room"
"Tolu trusted a new partner, who cheated him. He vetted deals, learning naivety’s cost.","Ọmọdé kékeré ò mọ ogun, ó ní k'ógun ó wá, ó ní b'ógún bá dé, òun a kó s'íyàrá ìyá òun",Naivety can be costly.,"A youngster, naive about wars, beckons on it, stating that once war comes, he/she will hide in his/her mother's room"
"Jide shared plans with a rival, losing his edge. He grew cautious, valuing perception.","Ọmọdé kékeré ò mọ ogun, ó ní k'ógun ó wá, ó ní b'ógún bá dé, òun a kó s'íyàrá ìyá òun",Naivety can be costly.,"A youngster, naive about wars, beckons on it, stating that once war comes, he/she will hide in his/her mother's room"
"Emeka lost his job but thanked God for health. His gratitude found new work, proving thankfulness pays. Faith gave reasons to hope.","Ọlọ́run kì í ṣe nǹkan, kó má fi àyè ọpẹ́ sí i; tó bá pá baba lórí, a sì fi irùngbọ̀n rọ́pò",We'll always have reasons to be thankful to God.,"God never does anything, without the rationale for thanksgiving; if he makes a man bald, he'll give the beard in replacement"
"Aisha faced debt but valued her family’s support. Her thanks brought aid, showing God’s gifts endure.","Ọlọ́run kì í ṣe nǹkan, kó má fi àyè ọpẹ́ sí i; tó bá pá baba lórí, a sì fi irùngbọ̀n rọ́pò",We'll always have reasons to be thankful to God.,"God never does anything, without the rationale for thanksgiving; if he makes a man bald, he'll give the beard in replacement"
"Tolu mourned a failed deal but cherished his skills. His gratitude opened doors, proving divine balance.","Ọlọ́run kì í ṣe nǹkan, kó má fi àyè ọpẹ́ sí i; tó bá pá baba lórí, a sì fi irùngbọ̀n rọ́pò",We'll always have reasons to be thankful to God.,"God never does anything, without the rationale for thanksgiving; if he makes a man bald, he'll give the beard in replacement"
"Kemi skipped work, expecting pay, but was fired. Her laziness cost her, teaching diligence pays. Hard work secured her next job.","Ẹni tó mú iṣẹ́ jẹ, ò lè mú ìṣẹ́ jẹ",Diligence pays.,"Whoever got away with indolence, cannot get away with poverty"
"Tolu delayed tasks, facing penalties. He worked steadily, earning trust, proving effort wins.","Ẹni tó mú iṣẹ́ jẹ, ò lè mú ìṣẹ́ jẹ",Diligence pays.,"Whoever got away with indolence, cannot get away with poverty"
"Jide slacked on sales, losing clients. His hustle regained them, valuing diligence.","Ẹni tó mú iṣẹ́ jẹ, ò lè mú ìṣẹ́ jẹ",Diligence pays.,"Whoever got away with indolence, cannot get away with poverty"
"Chidi lost his shop but gained new skills. His storm passed, proving no condition lasts. Hope rebuilt his life.","Ìjì layé; tó bá fì síwájú, á tún fì sẹ́hìn ni","A season goes, another comes; no condition is permanent; nothing lasts forever; keep hope alive.","Life is a storm; if it blows forward, it will blow backward, as well"
"Amaka faced divorce but found peace later. Her season changed, showing life’s cycles endure.","Ìjì layé; tó bá fì síwájú, á tún fì sẹ́hìn ni","A season goes, another comes; no condition is permanent; nothing lasts forever; keep hope alive.","Life is a storm; if it blows forward, it will blow backward, as well"
Tolu endured a slump but thrived after. His patience proved nothing is permanent.,"Ìjì layé; tó bá fì síwájú, á tún fì sẹ́hìn ni","A season goes, another comes; no condition is permanent; nothing lasts forever; keep hope alive.","Life is a storm; if it blows forward, it will blow backward, as well"
"Kemi’s loud singing drew complaints, hiding her talent. Her quiet practice shone, teaching looks deceive. Depth revealed truth.","Kòkòrò tó ńjó lẹ́ẹ̀bá ọ̀nà, onílù rẹ̀ ńbẹ nínú igbó",Things are often not quite as they appear; don't jump to conclusions before thorough and critical reviews.,The insect that is dancing by the bush path has its drummer right in the forest
"Tolu’s plain stall hid steady sales, fooling rivals. His success showed more than appeared, proving critical review matters.","Kòkòrò tó ńjó lẹ́ẹ̀bá ọ̀nà, onílù rẹ̀ ńbẹ nínú igbó",Things are often not quite as they appear; don't jump to conclusions before thorough and critical reviews.,The insect that is dancing by the bush path has its drummer right in the forest
"Jide’s calm demeanor masked his stress. His truth surfaced, showing not to judge quickly.","Kòkòrò tó ńjó lẹ́ẹ̀bá ọ̀nà, onílù rẹ̀ ńbẹ nínú igbó",Things are often not quite as they appear; don't jump to conclusions before thorough and critical reviews.,The insect that is dancing by the bush path has its drummer right in the forest
"Tolu fought every critic, exhausting himself. He ignored noise, succeeding, proving temperance wins. Cool heads prevailed.","Pé a lágbára bí òmìrán, ìyẹn ò ní kí a jà bí òmìrán","Be tempered: just because you can, does not mean you should; cooler heads should always prevail.","That you are as powerful as a giant, does not imply that you should fight like one"
"Amaka snapped at rivals, losing allies. She stayed calm, gaining partners, showing restraint matters.","Pé a lágbára bí òmìrán, ìyẹn ò ní kí a jà bí òmìrán","Be tempered: just because you can, does not mean you should; cooler heads should always prevail.","That you are as powerful as a giant, does not imply that you should fight like one"
