scenario,proverb,wisdom,translation
"Tunde’s startup was thriving, and friends praised his success. When it hit trouble, most stopped calling. Tunde relied on his resilience, learning loyalty is rare in tough times.",Àbàtà takété bí ẹni pé kò bá odò tan,"When the going gets tough, pretty few will stick with you: mentally prepare for this; everybody loves the winner, but when you lose, you are on your own.",The marshy place keeps aloof as if it is unrelated to the river
"Amaka was a star athlete, celebrated during wins. An injury sidelined her, and only family checked in. She braced for future challenges, knowing support often ties to success.",Àbàtà takété bí ẹni pé kò bá odò tan,"When the going gets tough, pretty few will stick with you: mentally prepare for this; everybody loves the winner, but when you lose, you are on your own.",The marshy place keeps aloof as if it is unrelated to the river
"Chidi’s campaign had loud supporters when polls favored him. As his opponent gained, many left, leaving a loyal few. He valued those who stayed and prepared for betrayals.",Àbàtà takété bí ẹni pé kò bá odò tan,"When the going gets tough, pretty few will stick with you: mentally prepare for this; everybody loves the winner, but when you lose, you are on your own.",The marshy place keeps aloof as if it is unrelated to the river
"Funmi lost her job and felt hopeless, struggling with rent. A stranger offered a freelance gig just as eviction loomed. She held onto hope, trusting solutions come unexpectedly.",Ilẹ̀ àánú Olúwa kì í ṣú,No impossibility with God: He cannot be contained or cornered; keep hope alive.,God's mercy never runs out
"Ade’s diagnosis was dire, with little optimism from doctors. A new treatment appeared, and he recovered. He kept praying, believing divine intervention changes situations.",Ilẹ̀ àánú Olúwa kì í ṣú,No impossibility with God: He cannot be contained or cornered; keep hope alive.,God's mercy never runs out
"Kemi called her business “just a side hustle,” and clients treated it casually. Labeling it a “growing enterprise” made customers take her seriously, increasing orders. Her words shaped perceptions.",Orúkọ tí a bá sọ ajá ẹni lọmọ aráyé ńbá ni í pèé,Speak positively: words objectify themselves; never describe yourself or what you do in negative terms.,"Whatever name one calls one's dog, that is the name others will call it as well"
"Jide joked about being “clumsy” at work, and colleagues distrusted him with projects. Describing himself as “careful” earned him more responsibility. Positive self-description changed his reputation.",Orúkọ tí a bá sọ ajá ẹni lọmọ aráyé ńbá ni í pèé,Speak positively: words objectify themselves; never describe yourself or what you do in negative terms.,"Whatever name one calls one's dog, that is the name others will call it as well"
"Bola’s friends called her art “cute doodles,” and she adopted the term. Labeling it “professional illustrations” drew gallery interest. Her words influenced her talent’s value.",Orúkọ tí a bá sọ ajá ẹni lọmọ aráyé ńbá ni í pèé,Speak positively: words objectify themselves; never describe yourself or what you do in negative terms.,"Whatever name one calls one's dog, that is the name others will call it as well"
"Emeka, a brilliant coder, struggled to market his app. A friend’s promotion help led to soaring downloads. He saw his skills needed others’ expertise.","Kò sí bí àtùpà ṣe lè lágbára tó, kò lè ríran rí ìdí ara rẹ̀","No matter how strong anyone is, he or she will always need the input of others; no one is wholly self-sufficient, nor indeed can be.","No matter how strong a lamp is, it cannot light up it's base"
Chioma ran her restaurant well but couldn’t fix plumbing alone. Hiring a professional saved her business. She learned even the capable need support.,"Kò sí bí àtùpà ṣe lè lágbára tó, kò lè ríran rí ìdí ara rẹ̀","No matter how strong anyone is, he or she will always need the input of others; no one is wholly self-sufficient, nor indeed can be.","No matter how strong a lamp is, it cannot light up it's base"
"Yemi trusted her colleague’s flattery, thinking they were friends. The colleague sabotaged her for a promotion. Yemi grew cautious, seeing intentions aren’t always genuine.","Ẹni a fẹ́ la mọ̀, a ò mọ ẹni tó fẹ́'ni",Be perceptive; things are often not as they appear.,"You do know who you love for sure, but you cannot be certain of who really loves you"
"Tolu lent money to a “loyal” friend who never repaid. A quiet acquaintance helped Tolu selflessly. She observed actions, not words, to discern loyalty.","Ẹni a fẹ́ la mọ̀, a ò mọ ẹni tó fẹ́'ni",Be perceptive; things are often not as they appear.,"You do know who you love for sure, but you cannot be certain of who really loves you"
"Sade thought her partner’s gifts showed love, but he was dismissive in her struggles. A neighbor supported her quietly. She valued sincerity over superficial gestures.","Ẹni a fẹ́ la mọ̀, a ò mọ ẹni tó fẹ́'ni",Be perceptive; things are often not as they appear.,"You do know who you love for sure, but you cannot be certain of who really loves you"
"Dayo bragged about coding skills before a senior developer, then fumbled at the task. The developer corrected him, and Dayo felt embarrassed. He learned quietly that it's better to embrace humility instead of boasting.","A kì í dámọ̀nràn àti tà'kìtì lágbàlá ọ̀bọ, nítorí ọ̀bọ fúnra'ra rẹ̀, ọba òkìtì ni",Be modest; don't make a needless show of your ignorance.,"Never toy with the idea of somersaulting in the vicinity of a monkey: monkeys themselves, are experts at somersaulting"
"Amara tried outshining a veteran chef with a flashy dish she barely practiced. Her dish failed, while the chef’s simple recipe won. She learnt to respect expertise and avoided showing off.","A kì í dámọ̀nràn àti tà'kìtì lágbàlá ọ̀bọ, nítorí ọ̀bọ fúnra'ra rẹ̀, ọba òkìtì ni",Be modest; don't make a needless show of your ignorance.,"Never toy with the idea of somersaulting in the vicinity of a monkey: monkeys themselves, are experts at somersaulting"
"Ngozi saved money while working a stable job, anticipating layoffs. When her company downsized, she started a side business calmly. Her backup plan kept her steady.",Àdàbà ò náání à ńkùn'gbẹ́; pápá ńjó ẹyẹ oko fò lọ,"Be strategic; in every situation, always have an assured plan B: it engenders calm in the midst of a storm.","The dove is unmoved by the bush being set on fire; once on fire, it simply flies away"
"Femi learned multiple skills, knowing his industry was volatile. When his job slowed, he pivoted to consulting without panic. His expertise was his escape route.",Àdàbà ò náání à ńkùn'gbẹ́; pápá ńjó ẹyẹ oko fò lọ,"Be strategic; in every situation, always have an assured plan B: it engenders calm in the midst of a storm.","The dove is unmoved by the bush being set on fire; once on fire, it simply flies away"
"Aisha had an exit strategy for her rentals. When her landlord raised rent, she moved to a prepared alternative. Her foresight kept her unruffled.",Àdàbà ò náání à ńkùn'gbẹ́; pápá ńjó ẹyẹ oko fò lọ,"Be strategic; in every situation, always have an assured plan B: it engenders calm in the midst of a storm.","The dove is unmoved by the bush being set on fire; once on fire, it simply flies away"
"Kunle led a top company, but economic shifts closed it. Now in a modest job, he accepts success can fade. He focuses on adapting.",Bàtà orí àkìtàn náà re òde ìyàwó rí,Change is inevitable: a season must need go and another must need come; nothing lasts forever.,Those pair of shoes on the refuse dump was once worn to a wedding
"Lara’s trendy boutique was popular until tastes changed. Her shop closed, but she retrained as a stylist. She understood no glory is permanent.",Bàtà orí àkìtàn náà re òde ìyàwó rí,Change is inevitable: a season must need go and another must need come; nothing lasts forever.,Those pair of shoes on the refuse dump was once worn to a wedding
"Chike posed as a generous donor to gain trust. His stinginess in private leaked, and people shunned him. His true nature couldn’t hide.",Èéfín ni ìwà; kò ṣeé fi pamọ́,We cannot pretend to be who we are not for very long.,Character is like smoke: it cannot be covered up
Ronke was polite at work but gossiped cruelly. Her exposed messages lost her colleagues’ trust. Her character revealed itself.,Èéfín ni ìwà; kò ṣeé fi pamọ́,We cannot pretend to be who we are not for very long.,Character is like smoke: it cannot be covered up
"Obi claimed honesty in pitches, but clients found exaggerated claims. They canceled contracts, ruining his reputation. His dishonesty surfaced.",Èéfín ni ìwà; kò ṣeé fi pamọ́,We cannot pretend to be who we are not for very long.,Character is like smoke: it cannot be covered up
"Tobi worked extra hours to fund education, despite mockery. He graduated and got a good job, while peers struggled. His hard work paid off.","Ṣiṣẹ́ ṣiṣẹ́ ò gọ̀, ó fẹ́ jàre ìṣẹ́ ni; ẹni tó kọ̀ tí ò ṣiṣẹ́ fẹ́ yan ìṣẹ́ láàyò ni",Diligence is a choice: choose right.,"The diligent isn't stupid, he or she simply wants to defeat poverty; the person who refuses to work, really seeks to partner with poverty"
"Ezinne built her tailoring business on weekends, despite exhaustion. Her dedication attracted clients, unlike idle peers. She chose diligence and prospered.","Ṣiṣẹ́ ṣiṣẹ́ ò gọ̀, ó fẹ́ jàre ìṣẹ́ ni; ẹni tó kọ̀ tí ò ṣiṣẹ́ fẹ́ yan ìṣẹ́ láàyò ni",Diligence is a choice: choose right.,"The diligent isn't stupid, he or she simply wants to defeat poverty; the person who refuses to work, really seeks to partner with poverty"
"Segun, a strong laborer, earned little lifting loads. Learning a skilled trade doubled his income. Wisdom outshone strength.",Ọgbọ́n ju agbára lọ,Pursue wisdom.,Wisdom is better than strength
Adaeze farmed with brute effort but had poor yields. Studying soil management boosted her crops with less work. Wisdom proved better.,Ọgbọ́n ju agbára lọ,Pursue wisdom.,Wisdom is better than strength
Uche wrestled easily but lost a deal due to poor negotiation. A strategy course won future contracts. Wisdom was more powerful.,Ọgbọ́n ju agbára lọ,Pursue wisdom.,Wisdom is better than strength
Kemi trusted an online “investor” promising quick returns. She lost savings when the scheme collapsed. She learned to verify trust.,"Òròmọadìyẹ ńbá àṣá ṣeré, ó rò pé ẹyẹ oko lásán ni","Naivety can be risky, if not fatally costly.",The chick gullibly plays with the hawk believing it to be an ordinary bird
"Bayo shared his startup idea with a competitor, thinking it was casual. The competitor launched it first, ruining Bayo’s plans. He guarded ideas after.","Òròmọadìyẹ ńbá àṣá ṣeré, ó rò pé ẹyẹ oko lásán ni","Naivety can be risky, if not fatally costly.",The chick gullibly plays with the hawk believing it to be an ordinary bird
"Tunde dismissed a coworker’s project warning. The issue cost the team, as the coworker predicted. Tunde respected all input after.","Bí afọ́jú bá lóun yóò fọ́'ni lójú, ó yẹ ká fura, nítorí tí kò bá mú nǹkan lọ́wọ́, ó lè tẹ nǹkan mọ́lẹ̀",Don't be presumptuous; underestimate no one.,"If a blind man threatens to make you blind, be wary; if he has nothing in his hands, he may have something under his feet"
"Amaka ignored a vendor’s threat to disrupt her supply. The vendor rallied others, delaying deliveries. She saw even minor players matter.","Bí afọ́jú bá lóun yóò fọ́'ni lójú, ó yẹ ká fura, nítorí tí kò bá mú nǹkan lọ́wọ́, ó lè tẹ nǹkan mọ́lẹ̀",Don't be presumptuous; underestimate no one.,"If a blind man threatens to make you blind, be wary; if he has nothing in his hands, he may have something under his feet"
Chidi laughed off a junior’s critique of his plan. The flaw she spotted tanked the campaign. He stopped underestimating others.,"Bí afọ́jú bá lóun yóò fọ́'ni lójú, ó yẹ ká fura, nítorí tí kò bá mú nǹkan lọ́wọ́, ó lè tẹ nǹkan mọ́lẹ̀",Don't be presumptuous; underestimate no one.,"If a blind man threatens to make you blind, be wary; if he has nothing in his hands, he may have something under his feet"
"Funmi loved spicy food, but Ada preferred mild. They stopped arguing and enjoyed separate dishes. Accepting differences strengthened them.","Èyí wù mí, ò wù ọ́, lọmọ ìyá méjì ṣe ńfẹ́ ìyàwó ọ̀tọ̀ọ̀tọ̀",Different strokes for different folks; people are entitled to their choices: live and let live.,What appeals to me does not necessarily appeal to you is the reason two maternal brothers have different wives
"Jide wanted a corporate job, while Tolu chose entrepreneurship. Their parents supported both, avoiding conflict. They respected individual choices.","Èyí wù mí, ò wù ọ́, lọmọ ìyá méjì ṣe ńfẹ́ ìyàwó ọ̀tọ̀ọ̀tọ̀",Different strokes for different folks; people are entitled to their choices: live and let live.,What appeals to me does not necessarily appeal to you is the reason two maternal brothers have different wives
"Ngozi moved abroad for a career, leaving friends behind. She missed them but gained success. She accepted the trade-off.",".Ẹni tó ńlé nǹkan níwájú, ńfi àwọn nǹkan míràn sẹ́hìn","There's always a price tag: we must let go of what is behind, if we want to lay hold of what is ahead.","Whoever is pursuing something ahead, is actually leaving some other things behind. I"
"Femi quit his job to start a business, losing short-term security. His venture grew, but he lost family evenings. Progress required letting go.",".Ẹni tó ńlé nǹkan níwájú, ńfi àwọn nǹkan míràn sẹ́hìn","There's always a price tag: we must let go of what is behind, if we want to lay hold of what is ahead.","Whoever is pursuing something ahead, is actually leaving some other things behind. I"
"Aisha focused on studies, skipping social events. She graduated with honors but missed fun. Her goal demanded sacrifices.",".Ẹni tó ńlé nǹkan níwájú, ńfi àwọn nǹkan míràn sẹ́hìn","There's always a price tag: we must let go of what is behind, if we want to lay hold of what is ahead.","Whoever is pursuing something ahead, is actually leaving some other things behind. I"
"Tobi ignored his wife’s tardiness, valuing their bond. Their marriage stayed strong through patience. Tolerance kept love alive.",Àmójúkúrò ni í mú ẹ̀mí ìfẹ́ gùn,"If it is wrong, love will not see it; tolerance is crucial.",Willingness to overlook is what makes for an enduring loving relationship
"Ezinne overlooked her friend’s blunt comments, knowing her heart was good. Their friendship endured where others faltered. She chose love over criticism.",Àmójúkúrò ni í mú ẹ̀mí ìfẹ́ gùn,"If it is wrong, love will not see it; tolerance is crucial.",Willingness to overlook is what makes for an enduring loving relationship
"Kemi fixed minor website bugs but ignored a security flaw. A hack cost her company, teaching her to prioritize critical issues. She saw the bigger picture.",A kì í fi ẹ̀tẹ̀ sílẹ̀ pa làpálàpá,Think perceptively and strategically: don't lose sight of the forest for the trees: look at the bigger picture; things are often more than they seem.,Do not leave leprosy unattended while preoccupied with treating ringworm
Jide perfected his car’s paint but ignored faulty brakes. A near-accident made him reassess. He addressed root problems first.,A kì í fi ẹ̀tẹ̀ sílẹ̀ pa làpálàpá,Think perceptively and strategically: don't lose sight of the forest for the trees: look at the bigger picture; things are often more than they seem.,Do not leave leprosy unattended while preoccupied with treating ringworm
Bola obsessed over party decor but neglected guests’ dietary needs. Complaints overshadowed the event. She planned broadly after.,A kì í fi ẹ̀tẹ̀ sílẹ̀ pa làpálàpá,Think perceptively and strategically: don't lose sight of the forest for the trees: look at the bigger picture; things are often more than they seem.,Do not leave leprosy unattended while preoccupied with treating ringworm
"Chidi yelled at his employee over a mistake, nearly firing him. After cooling off, the employee had resigned. He paused before reacting after.","Bí inú bá bí baba tó bá gbé ọmọ ẹ̀ jù sí inú èèrùn, bí inú ẹ̀ bá rọ̀, inú èèrùn lè má rọ̀",Don't be hasty in anger: calm down; avoid rashness.,"If a father gets so angry as to throw his child into a raid of army ants, by the time he calms down, the ants may not be"
"Amaka deleted her friend’s contact in anger. By the time she calmed, the friend had moved on. She avoided rash decisions later.","Bí inú bá bí baba tó bá gbé ọmọ ẹ̀ jù sí inú èèrùn, bí inú ẹ̀ bá rọ̀, inú èèrùn lè má rọ̀",Don't be hasty in anger: calm down; avoid rashness.,"If a father gets so angry as to throw his child into a raid of army ants, by the time he calms down, the ants may not be"
"Tolu pleased a difficult client with extra work, but they criticized him. He delivered quality and moved on. He stayed positive.","Báa gún iyán, táa ro ọkà fún kòfẹ́kògbà, kò ní fẹ́, kò ní gbà, náà ni","Be forward-looking, be positive; do your best and keep moving.","Even if you pound yam and prepare yam flour meal for a contentious person, he or she will yet remain contentious"
"Sade cooked for her grumpy neighbor, who complained. She stayed kind but focused on her goals. Positivity kept her unshaken.","Báa gún iyán, táa ro ọkà fún kòfẹ́kògbà, kò ní fẹ́, kò ní gbà, náà ni","Be forward-looking, be positive; do your best and keep moving.","Even if you pound yam and prepare yam flour meal for a contentious person, he or she will yet remain contentious"
"Obi exceeded a picky boss’s expectations, yet faced complaints. He did his best and sought better opportunities. He ignored negativity.","Báa gún iyán, táa ro ọkà fún kòfẹ́kògbà, kò ní fẹ́, kò ní gbà, náà ni","Be forward-looking, be positive; do your best and keep moving.","Even if you pound yam and prepare yam flour meal for a contentious person, he or she will yet remain contentious"
Emeka built a house alone but struggled with flaws. A team of builders finished it faster and better. Collaboration was key.,"Bó ti wù kí ojú kan tóbi tó, ojú méjì sàn ju ojú kan lọ",Team effort is superior.,"No matter how big an eye is, two eyes are better than one"
"Chioma planned a community event solo, but it was chaotic. A team’s help made it smooth next time. Group effort beat solo work.","Bó ti wù kí ojú kan tóbi tó, ojú méjì sàn ju ojú kan lọ",Team effort is superior.,"No matter how big an eye is, two eyes are better than one"
"Yemi’s employee was quitting due to stress, and she avoided criticism. Her kind exit interview led to a referral. She chose wisdom.",A kì í sọ òkò sí ẹyẹ tó ńwá ọ̀nà àti fò,Act in wisdom: do not pre-empt or worsen an already deplorable situation.,Do not throw stones at a bird that seeks to fly away
Tolu saw his friend struggling and didn’t press for a loan repayment. His patience preserved their bond. He avoided escalating tensions.,A kì í sọ òkò sí ẹyẹ tó ńwá ọ̀nà àti fò,Act in wisdom: do not pre-empt or worsen an already deplorable situation.,Do not throw stones at a bird that seeks to fly away
Sade gave her upset sister space instead of pushing her. Her sister opened up later. She acted wisely to avoid worsening things.,A kì í sọ òkò sí ẹyẹ tó ńwá ọ̀nà àti fò,Act in wisdom: do not pre-empt or worsen an already deplorable situation.,Do not throw stones at a bird that seeks to fly away
"Kemi demanded perfection from her team but overlooked her errors. They called her out, and she felt embarrassed. She held herself to the same standard.",Ikú fẹ́ pa alápatà ó ńkígbe; ọmọ ẹranko tó ti dá lóró ńkọ́?,Exact from no one what you are unwilling to impose on yourself; be fair and considerate.,Death stalks the butcher and he screams; what about the animals he's butchered?
"Jide criticized his sibling for laziness but ignored his procrastination. His sibling pointed out hypocrisy, and Jide changed. He practiced fairness.",Ikú fẹ́ pa alápatà ó ńkígbe; ọmọ ẹranko tó ti dá lóró ńkọ́?,Exact from no one what you are unwilling to impose on yourself; be fair and considerate.,Death stalks the butcher and he screams; what about the animals he's butchered?
"Tobi exaggerated his resume but couldn’t deliver. He was fired, losing more than he gained. He built skills honestly after.","Tí ìṣẹ́ ò bá jẹ́ ká sọ òdodo, àìṣòdodo kò ní jẹ́ ká bọ́ lọ́wọ́ ìṣẹ́","Honesty pays; dishonest lifestyle does exact hefty fees, at the end.","If fear of poverty makes us lie, lying will keep us entrenched in poverty, as well"
"Ezinne sold fake products for quick cash, but bad reviews collapsed her business. She rebuilt with integrity. Honesty proved valuable.","Tí ìṣẹ́ ò bá jẹ́ ká sọ òdodo, àìṣòdodo kò ní jẹ́ ká bọ́ lọ́wọ́ ìṣẹ́","Honesty pays; dishonest lifestyle does exact hefty fees, at the end.","If fear of poverty makes us lie, lying will keep us entrenched in poverty, as well"
"Ade hid a car’s faults to sell it, but the buyer sued. Legal fees drained him. He chose transparency thereafter.","Tí ìṣẹ́ ò bá jẹ́ ká sọ òdodo, àìṣòdodo kò ní jẹ́ ká bọ́ lọ́wọ́ ìṣẹ́","Honesty pays; dishonest lifestyle does exact hefty fees, at the end.","If fear of poverty makes us lie, lying will keep us entrenched in poverty, as well"
Funmi avoided studying late but wanted high grades. She failed and learned effort was key. She worked hard for success.,"Ojú tí kò rí yànnà yánná iná, yẹ̀rẹ̀ yẹrẹ oòrùn, kì í rí yìndìn yindin idẹ","No pain, no gain; no guts, no glory.","A pair of eyes that won't endure the fiery flames of fire, the searing glare of the sun, can't hope to enjoy the glittering beauty of brass"
"Jide skipped training, fearing injury, but dreamed of winning races. He lost and practiced rigorously. Sacrifice brought rewards.","Ojú tí kò rí yànnà yánná iná, yẹ̀rẹ̀ yẹrẹ oòrùn, kì í rí yìndìn yindin idẹ","No pain, no gain; no guts, no glory.","A pair of eyes that won't endure the fiery flames of fire, the searing glare of the sun, can't hope to enjoy the glittering beauty of brass"
"Ngozi’s job application failed, but an internship led to a better role. Multiple paths brought success. She stayed flexible.",Ọ̀nà kan ò wọ ọjà,Alternative approaches exist; there are many ways to achieve an end; don't be fixated on one.,Not just one route leads to the market
"Femi’s loan was denied, so he crowdfunded his startup. The campaign succeeded, showing other routes. He embraced alternatives.",Ọ̀nà kan ò wọ ọjà,Alternative approaches exist; there are many ways to achieve an end; don't be fixated on one.,Not just one route leads to the market
Aisha’s college rejection led to a vocational program. She built a thriving career. Different paths worked.,Ọ̀nà kan ò wọ ọjà,Alternative approaches exist; there are many ways to achieve an end; don't be fixated on one.,Not just one route leads to the market
"Tolu sabotaged his colleague’s promotion out of jealousy. The colleague left, cutting ties. Tolu lost a connection.",Ẹni tó bá ní kí ọ̀rẹ́ òun má jọba ni kò ní lọ̀rẹ́ ọba,Foster goodness: those plotting evil for others often share in the evil results; we reap whatever we sow.,"Whoever blocks his friend from becoming a king won't have a king as a friend.,"
"Sade discouraged her friend’s business, hoping to outshine her. The friend succeeded and distanced herself. Harming others backfired.",Ẹni tó bá ní kí ọ̀rẹ́ òun má jọba ni kò ní lọ̀rẹ́ ọba,Foster goodness: those plotting evil for others often share in the evil results; we reap whatever we sow.,"Whoever blocks his friend from becoming a king won't have a king as a friend.,"
Emeka lost a client by checking his phone during a meeting. He missed details and seemed uninterested. He stayed present after.,Ẹni tí a  ńbá ná'jà la ńwò a kì í wo ariwo ọjà,Be focused; shun distractions.,Wẹ should be focused on the person we are trading with and not the din and bustle in the market
Chioma got distracted by social media while studying and failed. Phone-free study hours improved her grades. Focus brought results.,Ẹni tí a  ńbá ná'jà la ńwò a kì í wo ariwo ọjà,Be focused; shun distractions.,Wẹ should be focused on the person we are trading with and not the din and bustle in the market
"Obi ignored a customer, drawn to a market argument. The customer left, costing a sale. He prioritized clients.",Ẹni tí a  ńbá ná'jà la ńwò a kì í wo ariwo ọjà,Be focused; shun distractions.,Wẹ should be focused on the person we are trading with and not the din and bustle in the market
