scenario,proverb,wisdom,translation
Sade’s sick child recovered after prayers. Her trust in God’s power grew stronger.,"Màlúù tí ò n'írù, Ọlọ́run ni í lé eṣinṣin fún un","God helps those who can't help themselves; whatever is impossible to man, is possible with God.",It's God that fends off flies for a cow that has no tail
"Yemi took a low-paying job to survive, hating it. It led to a dream role, showing detours have purpose. Focusing ahead kept him motivated.","Kí a tó dé ibi tí à ńlọ, a máa ńkọ́kọ́ dé ibi tí a kò fẹ́","Be focused, be strategic: always look ahead; don't lose the forest for the trees.","Before getting to our destination, we may have to get to where we'd rather not be"
"Kemi endured a tough internship, feeling stuck. It opened doors to a major firm, teaching her to look beyond the moment.","Kí a tó dé ibi tí à ńlọ, a máa ńkọ́kọ́ dé ibi tí a kò fẹ́","Be focused, be strategic: always look ahead; don't lose the forest for the trees.","Before getting to our destination, we may have to get to where we'd rather not be"
"Tolu worked nights to fund school, despite exhaustion. His degree landed a top job, proving strategic focus pays.","Kí a tó dé ibi tí à ńlọ, a máa ńkọ́kọ́ dé ibi tí a kò fẹ́","Be focused, be strategic: always look ahead; don't lose the forest for the trees.","Before getting to our destination, we may have to get to where we'd rather not be"
"Chidi partied with risky friends, ruining his suit. Their rough games cost him, teaching him to think before acting. He chose calmer company.","Ẹni tí ò fẹ́ wọ àkísà, kì í bá ajá ṣe eré e géle",Look before you leap; think before you act: actions come with consequences.,"Don't play rough with a dog, if you don't want to end up in tatters"
"Amaka wrestled with her dog, tearing her dress. She avoided rough play after, seeing actions have consequences.","Ẹni tí ò fẹ́ wọ àkísà, kì í bá ajá ṣe eré e géle",Look before you leap; think before you act: actions come with consequences.,"Don't play rough with a dog, if you don't want to end up in tatters"
"Sade joined a prank group, getting hurt. She left, learning to assess risks first.","Ẹni tí ò fẹ́ wọ àkísà, kì í bá ajá ṣe eré e géle",Look before you leap; think before you act: actions come with consequences.,"Don't play rough with a dog, if you don't want to end up in tatters"
"Tolu dwelled on past business failures, stalling growth. He set new goals, doubling sales. Forward focus drove success.",Odò tó ńṣàn kì í b'ojú w'ẹ̀hìn,Be forward-looking; be focused: no one drives forward with eyes on the rearview mirror.,A flowing stream never looks (or flows) backward
"Kemi obsessed over a lost deal, missing new ones. She moved on, signing bigger clients.",Odò tó ńṣàn kì í b'ojú w'ẹ̀hìn,Be forward-looking; be focused: no one drives forward with eyes on the rearview mirror.,A flowing stream never looks (or flows) backward
"Chidi kept regretting a breakup, slowing his career. He focused ahead, thriving in new ventures.",Odò tó ńṣàn kì í b'ojú w'ẹ̀hìn,Be forward-looking; be focused: no one drives forward with eyes on the rearview mirror.,A flowing stream never looks (or flows) backward
"Funmi criticized her colleague’s bad idea, not her character. Their bond stayed strong, and they improved the plan. Attacking ideas, not people, worked.",Àbá làá kó dànù; ẹnìkan kì í kó aláàbá dànù,A case against ad hominem; question and attack ideas not personalities.,"You may only discard a suggestion, but not the one who made it"
"Jide rejected his friend’s risky proposal but kept their tie. They collaborated later, proving ideas can be questioned without harm.",Àbá làá kó dànù; ẹnìkan kì í kó aláàbá dànù,A case against ad hominem; question and attack ideas not personalities.,"You may only discard a suggestion, but not the one who made it"
"Sade disliked her boss’s strategy but respected her. She suggested tweaks, earning trust.",Àbá làá kó dànù; ẹnìkan kì í kó aláàbá dànù,A case against ad hominem; question and attack ideas not personalities.,"You may only discard a suggestion, but not the one who made it"
"Tolu took his reliable bike for granted, neglecting it. It broke down, stranding him, and he valued it after repairs. Treasuring what he had saved loss.","Èyàn kì í mọ iyì ohun tó ní, à fi tó bá sọ ọ́ nù","Take nothing desired for granted: we lose, sometimes permanently, whatever we take for granted; treasure whatever you wish to keep.","We seldom appreciate what we have, until we lose the thing"
"Kemi ignored her old phone until it failed, losing contacts. She backed up her new one, learning to appreciate tools.","Èyàn kì í mọ iyì ohun tó ní, à fi tó bá sọ ọ́ nù","Take nothing desired for granted: we lose, sometimes permanently, whatever we take for granted; treasure whatever you wish to keep.","We seldom appreciate what we have, until we lose the thing"
"Aisha overlooked her mentor’s advice, missing opportunities. After losing her, she cherished guidance.","Èyàn kì í mọ iyì ohun tó ní, à fi tó bá sọ ọ́ nù","Take nothing desired for granted: we lose, sometimes permanently, whatever we take for granted; treasure whatever you wish to keep.","We seldom appreciate what we have, until we lose the thing"
"Chidi’s coffee tasted bitter, revealing spoiled milk. He checked expiry dates after, seeing reasons behind issues. Investigating anomalies prevented waste.",Omi kì í korò lẹ́nu láì ní ìdí,There is a reason for every seeming anomaly; there is not smoke without fire.,Water does not just taste bitter in the mouth without a reason
"Amaka’s car stalled, traced to bad fuel. She used trusted stations, knowing problems have causes.",Omi kì í korò lẹ́nu láì ní ìdí,There is a reason for every seeming anomaly; there is not smoke without fire.,Water does not just taste bitter in the mouth without a reason
"Sade’s plant wilted, due to overwatering. She adjusted care, learning issues aren’t random.",Omi kì í korò lẹ́nu láì ní ìdí,There is a reason for every seeming anomaly; there is not smoke without fire.,Water does not just taste bitter in the mouth without a reason
"Tolu rushed his baking, serving raw bread. He heated the oven properly, perfecting his loaves. Effort brought results.","Bí agbada ò bá gbóná, àgbàdo ò leè ta","Good things do not always come easy; no pain, no gain.","If the frying pan is not heated up, the corns cannot pop"
"Kemi skipped workouts, expecting fitness. She trained hard, gaining strength, proving pain yields gain.","Bí agbada ò bá gbóná, àgbàdo ò leè ta","Good things do not always come easy; no pain, no gain.","If the frying pan is not heated up, the corns cannot pop"
"Chidi wrote code hastily, facing bugs. Diligent debugging fixed it, showing effort is key.","Bí agbada ò bá gbóná, àgbàdo ò leè ta","Good things do not always come easy; no pain, no gain.","If the frying pan is not heated up, the corns cannot pop"
"Emeka endured a harsh job, hoping for relief. A promotion came, proving tough times pass. Hope sustained him.","Bí èyàn bá dúró sínú oòrùn títí, bó pẹ́ bó yá, ibòji, á báa níbẹ̀",Tough times cannot last forever; keep hope alive.,"If one tarries long in the sun, eventually, the shade will come (when the sun sets)"
"Aisha’s shop struggled in a slump, but sales rebounded. She held on, seeing seasons change.","Bí èyàn bá dúró sínú oòrùn títí, bó pẹ́ bó yá, ibòji, á báa níbẹ̀",Tough times cannot last forever; keep hope alive.,"If one tarries long in the sun, eventually, the shade will come (when the sun sets)"
"Tolu faced loan rejections, but one passed. Patience showed hard times end.","Bí èyàn bá dúró sínú oòrùn títí, bó pẹ́ bó yá, ibòji, á báa níbẹ̀",Tough times cannot last forever; keep hope alive.,"If one tarries long in the sun, eventually, the shade will come (when the sun sets)"
"Kemi panicked during a project crisis, worsening it. She calmed down, solving it step-by-step. Patience handled complexity.","Òkun kì í hó ruru, kí á wà á ruru",Be patient; complex issues should be carefully and patiently handled.,Never paddle wildly in a stormy sea
"Jide rushed a repair, breaking his phone. Slow care fixed it later, teaching calm precision.","Òkun kì í hó ruru, kí á wà á ruru",Be patient; complex issues should be carefully and patiently handled.,Never paddle wildly in a stormy sea
"Sade argued in a dispute, escalating it. She listened calmly, resolving it peacefully.","Òkun kì í hó ruru, kí á wà á ruru",Be patient; complex issues should be carefully and patiently handled.,Never paddle wildly in a stormy sea
"Funmi envied her friend’s fast career, rushing her own. She crashed but thrived at her pace. Staying in her lane worked.",Ìgbín ò lè sáré bí Ajá; ìyẹn ò ní kó máà de ibi tó ńlọ,"We are all uniquely endowed, and complete enough to live out our lives; stay in your lane: envy no one.",The snail cannot run as fast as the dog; that won't stop it from getting to wherever it's going
"Tolu copied his rival’s business, failing. He built his unique brand, succeeding by being himself.",Ìgbín ò lè sáré bí Ajá; ìyẹn ò ní kó máà de ibi tó ńlọ,"We are all uniquely endowed, and complete enough to live out our lives; stay in your lane: envy no one.",The snail cannot run as fast as the dog; that won't stop it from getting to wherever it's going
"Chidi chased others’ wealth, losing focus. His steady path brought stability.",Ìgbín ò lè sáré bí Ajá; ìyẹn ò ní kó máà de ibi tó ńlọ,"We are all uniquely endowed, and complete enough to live out our lives; stay in your lane: envy no one.",The snail cannot run as fast as the dog; that won't stop it from getting to wherever it's going
"Emeka planned a solo event, missing details. A team’s help made it flawless, proving collaboration wins. Teamwork outdid lone effort.","Bó ti wù kí ojú kan tóbi tó, ojú méjì sàn ju ojú kan lọ",Team spirit is it; together everyone achieves more; cooperate and collaborate more.,"No matter how big an eye is, two eyes are better than one"
"Aisha coded alone, hitting bugs. Colleagues’ input fixed it, showing two eyes beat one.","Bó ti wù kí ojú kan tóbi tó, ojú méjì sàn ju ojú kan lọ",Team spirit is it; together everyone achieves more; cooperate and collaborate more.,"No matter how big an eye is, two eyes are better than one"
"Tolu marketed solo, with weak results. A group campaign soared, valuing team spirit.","Bó ti wù kí ojú kan tóbi tó, ojú méjì sàn ju ojú kan lọ",Team spirit is it; together everyone achieves more; cooperate and collaborate more.,"No matter how big an eye is, two eyes are better than one"
"Funmi overdid favors for a client, who stayed ungrateful. She did her best and moved on, accepting not all can be pleased.","Ká mú ẹyin sí ọwọ́ ọ̀tún, ká mú ẹyìn sí ọwọ́ òsì, ká fí ẹ̀yìn rìn láti Ìsẹ́yìn dé Ìyìn Èkìtì, ẹni tí kò ní fi iṣẹ́ yin'ni kò ni fi yin’ni",You can't please everyone: do your very best and move on.,"Even if one were to grab an egg with the right hand, a palm-nut with the left, and retro-walked from Iseyin (a town) to Iyin Ekiti, those who won't be grateful, still won't be"
"Jide gifted his neighbor endlessly, but they complained. He focused on others, knowing some won’t value effort.","Ká mú ẹyin sí ọwọ́ ọ̀tún, ká mú ẹyìn sí ọwọ́ òsì, ká fí ẹ̀yìn rìn láti Ìsẹ́yìn dé Ìyìn Èkìtì, ẹni tí kò ní fi iṣẹ́ yin'ni kò ni fi yin’ni",You can't please everyone: do your very best and move on.,"Even if one were to grab an egg with the right hand, a palm-nut with the left, and retro-walked from Iseyin (a town) to Iyin Ekiti, those who won't be grateful, still won't be"
"Sade taught kids for free, but parents grumbled. She helped elsewhere, unbothered by ingrates.","Ká mú ẹyin sí ọwọ́ ọ̀tún, ká mú ẹyìn sí ọwọ́ òsì, ká fí ẹ̀yìn rìn láti Ìsẹ́yìn dé Ìyìn Èkìtì, ẹni tí kò ní fi iṣẹ́ yin'ni kò ni fi yin’ni",You can't please everyone: do your very best and move on.,"Even if one were to grab an egg with the right hand, a palm-nut with the left, and retro-walked from Iseyin (a town) to Iyin Ekiti, those who won't be grateful, still won't be"
"Chidi feared pitching his startup, delaying it. He risked it, landing funds, proving boldness pays. Calculated risks brought gain.","Ẹni tó ńbẹ̀rù àti ṣubú, àti dìde á nira fún un","Be bullish; take calculated risks; nothing ventured, nothing gained.",Whoever is scared of falling will find rising pretty tough
"Amaka avoided investing, scared of loss. She tried small stocks, earning profits, seeing risk’s value.","Ẹni tó ńbẹ̀rù àti ṣubú, àti dìde á nira fún un","Be bullish; take calculated risks; nothing ventured, nothing gained.",Whoever is scared of falling will find rising pretty tough
"Tolu shunned public speaking, fearing failure. He spoke, gaining clients, embracing bold moves.","Ẹni tó ńbẹ̀rù àti ṣubú, àti dìde á nira fún un","Be bullish; take calculated risks; nothing ventured, nothing gained.",Whoever is scared of falling will find rising pretty tough
"Kemi bragged about her strength to a struggling friend. Her friend withdrew, hurt by her insensitivity. She showed empathy after.","A kì í ṣe fáàrí ẹ̀ṣẹ́ dídì, si ọmọ adẹ́tẹ̀","Be considerate, courteous and tactful. Be sensitive and show empathy.",Don’t brag about fists in the presence of a leper
"Jide mocked a sick colleague’s weakness, losing trust. He apologized, learning tactful care.","A kì í ṣe fáàrí ẹ̀ṣẹ́ dídì, si ọmọ adẹ́tẹ̀","Be considerate, courteous and tactful. Be sensitive and show empathy.",Don’t brag about fists in the presence of a leper
"Sade flaunted her skills to a novice, discouraging them. She mentored gently, building their confidence.","A kì í ṣe fáàrí ẹ̀ṣẹ́ dídì, si ọmọ adẹ́tẹ̀","Be considerate, courteous and tactful. Be sensitive and show empathy.",Don’t brag about fists in the presence of a leper
"Tolu hid his gossip habit, but it spread, ruining ties. His true nature surfaced, costing friends. Character always shows.",Èéfín ni ìwà; kò ṣeé fi pamọ́,"No one can pretend to be who he is not for long; ultimately, our character shows through.",Character is like smoke; it cannot be covered up
"Aisha faked kindness at work, but her rudeness leaked. Colleagues shunned her, proving pretense fails.",Èéfín ni ìwà; kò ṣeé fi pamọ́,"No one can pretend to be who he is not for long; ultimately, our character shows through.",Character is like smoke; it cannot be covered up
"Chidi lied about his skills, but failures exposed him. His real self emerged, teaching honesty.",Èéfín ni ìwà; kò ṣeé fi pamọ́,"No one can pretend to be who he is not for long; ultimately, our character shows through.",Character is like smoke; it cannot be covered up
"Kemi chased multiple clients, delivering poorly. She focused on one, excelling, proving focus beats scatter. Prioritizing worked.","Ẹni bá ńsọ òkò sí adìyẹ igba, òkò ló máa sọ tí ilẹ̀ á fi ṣú","Be focused; don't flock shoot; to focus on doing too many at once, is a recipe for doing none.","Whoever is throwing stones at two hundred hens, will be at it until the evening"
"Jide juggled three jobs, burning out. He picked one, thriving, seeing less is more.","Ẹni bá ńsọ òkò sí adìyẹ igba, òkò ló máa sọ tí ilẹ̀ á fi ṣú","Be focused; don't flock shoot; to focus on doing too many at once, is a recipe for doing none.","Whoever is throwing stones at two hundred hens, will be at it until the evening"
"Tolu taught many subjects, confusing students. He specialized, improving results with focus.","Ẹni bá ńsọ òkò sí adìyẹ igba, òkò ló máa sọ tí ilẹ̀ á fi ṣú","Be focused; don't flock shoot; to focus on doing too many at once, is a recipe for doing none.","Whoever is throwing stones at two hundred hens, will be at it until the evening"
"Emeka prayed for a job, landing one beyond his dreams. The fit overwhelmed him, showing prayers work. Faith brought abundance.","Tí àdúrà bá gbà tán, apá aládúrà ò ní ká a",Prayers work; God's response can be so complete as to be overwhelming.,"When a prayer is answered, the person who prayed would be overwhelmed"
"Aisha sought healing through prayer, recovering fast. The miracle stunned her, proving divine answers.","Tí àdúrà bá gbà tán, apá aládúrà ò ní ká a",Prayers work; God's response can be so complete as to be overwhelming.,"When a prayer is answered, the person who prayed would be overwhelmed"
"Sade prayed for funds, receiving a grant. Its scale amazed her, reinforcing prayer’s power.","Tí àdúrà bá gbà tán, apá aládúrà ò ní ká a",Prayers work; God's response can be so complete as to be overwhelming.,"When a prayer is answered, the person who prayed would be overwhelmed"
"Chidi answered every critic online, losing time. He ignored noise, boosting his blog’s growth. Focus trumped distractions.","Gbogbo ọ̀rọ̀ ló lésì, ṣùgbọ́n kì í ṣe gbogbo ọ̀rọ̀ làá fèsì sí",Be focused and ignore distractions; not all issues deserve one's attention.,"There is always an appropriate response to every statement, but it's not every statement that one responds to"
"Kemi debated petty gossip, stalling work. She skipped it, finishing projects faster.","Gbogbo ọ̀rọ̀ ló lésì, ṣùgbọ́n kì í ṣe gbogbo ọ̀rọ̀ làá fèsì sí",Be focused and ignore distractions; not all issues deserve one's attention.,"There is always an appropriate response to every statement, but it's not every statement that one responds to"
"Tolu responded to all complaints, draining energy. He addressed key ones, saving effort.","Gbogbo ọ̀rọ̀ ló lésì, ṣùgbọ́n kì í ṣe gbogbo ọ̀rọ̀ làá fèsì sí",Be focused and ignore distractions; not all issues deserve one's attention.,"There is always an appropriate response to every statement, but it's not every statement that one responds to"
"Jide blamed his rival for a loss, hurting himself. His spite delayed recovery, teaching positivity. Forward focus rebuilt his brand.","Àgbẹ̀ tó roko tí kò gbin ọkà lóun dá ikún lóró; ikún kọ́ ló dá lóró, ara ẹ̀ ló dá lóró","Be positive, be forward-looking; vindictive actions can be self-limiting.","A farmer who ploughed his farm, but planted no corn claims he's hurting the ground squirrel; he hasn't hurt any squirrel, but himself"
"Amaka sought revenge on a cheating client, losing focus. She moved on, gaining better deals.","Àgbẹ̀ tó roko tí kò gbin ọkà lóun dá ikún lóró; ikún kọ́ ló dá lóró, ara ẹ̀ ló dá lóró","Be positive, be forward-looking; vindictive actions can be self-limiting.","A farmer who ploughed his farm, but planted no corn claims he's hurting the ground squirrel; he hasn't hurt any squirrel, but himself"
"Sade plotted against a rude neighbor, wasting time. She ignored them, thriving with positivity.","Àgbẹ̀ tó roko tí kò gbin ọkà lóun dá ikún lóró; ikún kọ́ ló dá lóró, ara ẹ̀ ló dá lóró","Be positive, be forward-looking; vindictive actions can be self-limiting.","A farmer who ploughed his farm, but planted no corn claims he's hurting the ground squirrel; he hasn't hurt any squirrel, but himself"
"Kemi stayed honest at work, avoiding false blame. Her integrity shielded her from rumors. Truth kept her clear.","Bí èyàn ò bá rìn ní igbèrí irọ́, wọn kì í paá mọ́'ni","Personal integrity is crucial; quite often, it determines one's experience.","If one is not within the vicinity of falsehoods, one cannot be falsely accused"
"Tolu refused to lie on a deal, dodging a scam. His honesty saved his funds.","Bí èyàn ò bá rìn ní igbèrí irọ́, wọn kì í paá mọ́'ni","Personal integrity is crucial; quite often, it determines one's experience.","If one is not within the vicinity of falsehoods, one cannot be falsely accused"
"Chidi admitted a mistake, escaping false accusations. Integrity protected his name.","Bí èyàn ò bá rìn ní igbèrí irọ́, wọn kì í paá mọ́'ni","Personal integrity is crucial; quite often, it determines one's experience.","If one is not within the vicinity of falsehoods, one cannot be falsely accused"
"Funmi let her son dodge chores, enabling laziness. She assigned tasks, building his duty. Firm guidance curbed irresponsibility.","Bí ọmọdé bá lóun ò mẹ̀wẹ̀, pé òun ò mòwè, àá sì já ẹ̀wẹ̀ sí ọwọ ọ̀tún, àá já òwè sí ọwọ òsì fún un ni","Assert real (or feigned) ignorance of personal responsibility gently, but firmly; don't encourage abdication of responsibility.","If a youngster claims ignorance of the ẹ̀wẹ̀ and òwè leaves, one ought to pluck one on his (or her) right hand and the other on his left for him"
"Jide excused his staff’s delays, causing chaos. He set deadlines, improving output with accountability.","Bí ọmọdé bá lóun ò mẹ̀wẹ̀, pé òun ò mòwè, àá sì já ẹ̀wẹ̀ sí ọwọ ọ̀tún, àá já òwè sí ọwọ òsì fún un ni","Assert real (or feigned) ignorance of personal responsibility gently, but firmly; don't encourage abdication of responsibility.","If a youngster claims ignorance of the ẹ̀wẹ̀ and òwè leaves, one ought to pluck one on his (or her) right hand and the other on his left for him"
"Aisha allowed her sibling to skip school, harming them. She enforced study, fostering growth.","Bí ọmọdé bá lóun ò mẹ̀wẹ̀, pé òun ò mòwè, àá sì já ẹ̀wẹ̀ sí ọwọ ọ̀tún, àá já òwè sí ọwọ òsì fún un ni","Assert real (or feigned) ignorance of personal responsibility gently, but firmly; don't encourage abdication of responsibility.","If a youngster claims ignorance of the ẹ̀wẹ̀ and òwè leaves, one ought to pluck one on his (or her) right hand and the other on his left for him"
"Emeka’s tall son reached a high shelf for an elder. Their teamwork solved the issue, proving mutual need. Collaboration bridged gaps.","Àgbàlagbà tó bá fẹ́ fọ inú akèrègbè mọ́ gbọ́dò ṣ'ọ̀rẹ́ ọmọdé, bẹ́ẹ̀ náà ni ọmọdé tó bá fẹ́ mú nǹkan lórí pẹpẹ gbọdọ̀ sún mọ́ àgbàlagbà nítorí ọwọ́ ọmọdé ò tó pẹpẹ t'àgbàlagbà ò wọ akèrègbè",No one can do it all; we do need one another; cooperate and collaborate more.,"An elderly person who wants to wash the inside of a gourd, clean, must befriend a child; so also a child who wants to retrieve something on a high shelf must be close to an elder, because a child's hand cannot reach a shelf; and that of an elder won't enter a gourd"
"Kemi’s small hands cleaned a tight jar for her aunt. They worked together, showing interdependence.","Àgbàlagbà tó bá fẹ́ fọ inú akèrègbè mọ́ gbọ́dò ṣ'ọ̀rẹ́ ọmọdé, bẹ́ẹ̀ náà ni ọmọdé tó bá fẹ́ mú nǹkan lórí pẹpẹ gbọdọ̀ sún mọ́ àgbàlagbà nítorí ọwọ́ ọmọdé ò tó pẹpẹ t'àgbàlagbà ò wọ akèrègbè",No one can do it all; we do need one another; cooperate and collaborate more.,"An elderly person who wants to wash the inside of a gourd, clean, must befriend a child; so also a child who wants to retrieve something on a high shelf must be close to an elder, because a child's hand cannot reach a shelf; and that of an elder won't enter a gourd"
Tolu lifted heavy boxes for a young neighbor. Their partnership highlighted shared reliance.,"Àgbàlagbà tó bá fẹ́ fọ inú akèrègbè mọ́ gbọ́dò ṣ'ọ̀rẹ́ ọmọdé, bẹ́ẹ̀ náà ni ọmọdé tó bá fẹ́ mú nǹkan lórí pẹpẹ gbọdọ̀ sún mọ́ àgbàlagbà nítorí ọwọ́ ọmọdé ò tó pẹpẹ t'àgbàlagbà ò wọ akèrègbè",No one can do it all; we do need one another; cooperate and collaborate more.,"An elderly person who wants to wash the inside of a gourd, clean, must befriend a child; so also a child who wants to retrieve something on a high shelf must be close to an elder, because a child's hand cannot reach a shelf; and that of an elder won't enter a gourd"
"Chidi hunted daily but missed some game. He won key catches, proving selective wins matter. Picking battles saved energy.",Gbogbo ìgbẹ́ kọ́ lọdẹ ti ńpa ọ̀yà; gbogbo ogun kọ́ lakíkanjú ti ńyege,"You needn't win all battles to win the war: just win the right ones; pick your battles, wisely: don't get embroiled in trivialities.",It's not from all forests that a hunter kills a grasscutter; it's not all battles that a warrior wins
"Aisha fought every client dispute, exhausting herself. She settled key ones, preserving strength.",Gbogbo ìgbẹ́ kọ́ lọdẹ ti ńpa ọ̀yà; gbogbo ogun kọ́ lakíkanjú ti ńyege,"You needn't win all battles to win the war: just win the right ones; pick your battles, wisely: don't get embroiled in trivialities.",It's not from all forests that a hunter kills a grasscutter; it's not all battles that a warrior wins
